index,subreddit,title
23,nottheonion,Content of Truth Nutrition Fermented Vegan BCAA Powder- 2:1:1 Ratio All Natural Branched Chain Amino Acids for Energy
24,nottheonion,Content of Hydrogen vehicle
25,nottheonion,Content of Large information
26,nottheonion,Content of Digitization
28,nottheonion,Content Youngster nourishment
29,nottheonion,Content of Emergency communication system
30,nottheonion,Content of Nutrition and pregnancy
31,nottheonion,Content of Apple Macbook Air Laptop
32,nottheonion,Content of Marketing research
33,nottheonion,Content of Youngster discipline
34,nottheonion,Content of Financial turn of events
35,nottheonion,Content of Apple Macbook Pro
36,nottheonion,Content of Bayesian deduction in promoting
37,nottheonion,Content of Health economics
38,nottheonion,Content of Apple Macbook Pro (16 Inch )
39,nottheonion,Content of Scenario planning
40,nottheonion,Content of Food structure information
41,nottheonion,Content of Quality administration
42,nottheonion,Digital Shopping
43,nottheonion,Content of Quality administration framework
44,nottheonion,Content of Association improvement
45,nottheonion,Content of Business process management
46,nottheonion,Content Of Women's Lightweight Full Zip Soft Polar Fleece Jacket
47,nottheonion,Content of Electronic business
48,nottheonion,"Content of Halloween Kimono for Kids, Women And Men"
49,nottheonion,Content of Cotton Turkish Towel Robe Lightweight with Embroidery for Men Women
50,nottheonion,Content of Beauty Bioscience Quench
51,nottheonion,Content of Computer keyboard
52,nottheonion,Content of Natural skin care
53,nottheonion,Content of Juice Beauty Stem Cellular Anti-Wrinkle Solutions
54,nottheonion,Content of Human–PC cooperation
55,nottheonion,Amazon-owned Twitch bans Amazon account after breast revealed on air
56,nottheonion,Content of Westmore Beauty Body Coverage Perfector
57,nottheonion,Content of Yon-Ka Age Exception Excellence Code Creme
58,nottheonion,"Content of SISLEY L 'Integral Anti Age Cream, 1.6 Ounce"
59,nottheonion,Content of Project Interactive planning
60,nottheonion,Content of Olay Regenerist Retinol 24 Max Moisturizer
61,nottheonion,Content of Essential 3 Facial Set Natural Botanical Anti Aging Skin Care Kit
62,nottheonion,Third-graders were allegedly asked to reenact events from the Holocaust. A staff member has now been put on leave.
63,nottheonion,Third-grade students were allegedly told to reenact elements of the Holocaust
64,nottheonion,"Content of Belifu Dual Channel TENS EMS Unit 24 Modes Muscle Stimulator for Pain Relief Therapy, Electronic Pulse Massager Muscle Massager with 10 Pads, Dust-Proof Drawstring Storage Bag，Fastening Cable Ties"
65,nottheonion,Swedish company showcases microchip that can download COVID-19 passport status
67,nottheonion,Iphone pro 12
70,nottheonion,"Pub landlord, caretaker and monarch sought for isolated Piel Island | Cumbria"
71,nottheonion,'The world's best place to be a woman' is being sued for misogyny
72,nottheonion,Harlem Globetrotters Announce “Spread Game” Tour
73,nottheonion,Spread-Game-Tour
74,nottheonion,Two monkeys captured after Killing hundreds of puppy in Indian village
75,nottheonion,"Infant dies, woman critical as man attempts delivery procedure watching YouTube videos"
76,nottheonion,Brigitte Macron will sue after absurd rumours she was born MALE
77,nottheonion,Trump Sues New York A.G. in Attempt to Stop Inquiry Into His Business
78,nottheonion,Content of Skin-Glow Cream
79,nottheonion,Content of Princess Costumes Dress Up Clothes for Little Girls-Luxury Sequin Dress for Christmas Birthday Halloween Party
80,nottheonion,Florida teens held after crash leaves two alligators hanging from truck window
81,nottheonion,Monkeys Captured After Killing 250 Dogs in 'Revenge' Killings in Indian Town
83,nottheonion,Booster shots and free rapid tests: A sneakerhead’s guide to waiting in lines
84,nottheonion,Interstate 69 will open for traffic next week in Martinsville
85,nottheonion,Nintendo Sues Guy for $25 He Made Selling N64 on eBay
86,nottheonion,Marjorie Taylor Greene owns stock in 3 vaccine manufacturers
89,nottheonion,Disney Guest Claims He Was Forced to Urinate in Splash Mountain
90,nottheonion,Nigerian soldier arrested for accepting marriage proposal
92,nottheonion,DC 3rd graders made to reenact Holocaust 'because Jews ruined Christmas'
93,nottheonion,"Demi Lovato Serenades ‘Ghost’ Who Faced Trauma from Sexism, Receives ‘Floating’ Ovation"
94,nottheonion,"Elon Musk says Tesla doesn't get 'rewarded' for lives saved by its Autopilot technology, but instead gets 'blamed' for the individuals it doesn't"
95,nottheonion,Jake Paul defeats Tyron Woodley with a knockout in the 6th round
97,nottheonion,Turismo Virtual *Rio Grande do Norte*
98,nottheonion,Scientists taught a petri dish of brain cells to play pong faster than an AI
1,nottheonion,Watch MrBEAST BURGER Full Menu Challenge. World’s First Free Restaurant
3,nottheonion,North Korea bans laughing for 11 days during mourning for anniversary of Kim Jong-il's death – video | World news
4,nottheonion,Quidditch leagues set to pick new name after JK Rowling trans row
7,nottheonion,"After taking in Afghan commandos, the British military may try to build another elite special-operations force"
8,nottheonion,D.C. third-graders were made to reenact episodes from the Holocaust
10,nottheonion,A School Librarian Instructs Third-Graders to Re-enact Scenes From Holocaust
11,nottheonion,"Watch : Tasted MrBeast Burger Restaurant. How good is MrBeast Burger food, really?"
13,nottheonion,Jewish woman accused of antisemitism by Labour threatens to sue
15,nottheonion,Chatting over cheese and wine: anatomy of Downing Street lockdown gathering | Boris Johnson
16,nottheonion,"Hong Kong offers free transport on 'patriots' election day, but citizens seize chance to travel around city"
17,nottheonion,Lagos Party Attendants Kill Guest For Collecting Food Several Times!
18,nottheonion,Melbourne six-year-old and her siblings pool pocket money to buy their first home
20,nottheonion,Joe Manchin’s Christmas gift to America: Killing the Build Back Better horror
21,nottheonion,Maharashtra: Fuming monkeys kill 250 dogs in revenge massacre after death of baby monkey
24,nottheonion,Enraged monkeys kill 250 dogs to take 'revenge' after puppy kills baby monkey
25,nottheonion,Stafford Co. police searching for $100 ‘Hamburglar’
27,nottheonion,Government report admits there are 23.5 Million people in England who have NOT had a single dose of a Covid-19 Vaccine
28,nottheonion,2 Monkeys Captured After Killing 250 Dogs in 'Revenge' Killing of Baby Monkey Murdered by Dogs
30,nottheonion,Taliban facing grumbles over pay from rank-and-file troops as fighting for God is no longer enough
31,nottheonion,Five Nights at Freddy’s: Security Breach. Wach Part 2. Who is Vanessa? Who is Vanny?
32,nottheonion,Vatican appoints new bishop to Vietnam diocese - UCA News
34,nottheonion,Drink-driver downs hand sanitiser to ‘trick’ breathalyser – forgetting it’s alcoholic
35,nottheonion,"Third-Graders Instructed to Re-enact Scenes From Holocaust, Principal Says"
36,nottheonion,North Korea bans laughing for 11 days during mourning for anniversary of Kim Jong-il's death
37,nottheonion,"North Korea Has Banned Laughing, Drinking, Celebrating BIrthdays, And Buying Food For 11 Days To Honor The 10 Years Of Kim Jung-Un's Rule"
38,nottheonion,2 monkeys arrested for killing 250+ dogs in a revenge massacre
39,nottheonion,Trump demands China pay $60T in 'reparations' for pandemic - Around World journal
40,nottheonion,Reoperations?
41,nottheonion,Trump Demands China Pay 60 TRILLION in Reparations Pandemic
42,nottheonion,is Tom Holland still going to be Spider Man? After ‘No Way Home’
43,nottheonion,These are your leaders and celebrities! This has to be exposed! Save the kids who are being trafficked by these disgusting individuals! How long have they actually been getting away with this!!! Our world is not suppose to be like this. The world is ran by mentally ill people!
44,nottheonion,Taliban complain about working conditions
45,nottheonion,NCIS LA may get canceled because actor of who Murdered two women
46,nottheonion,2 monkeys captured in Maharashtra's Beed. They were involved in killing of over 250 dogs
47,nottheonion,Florida schools warn students against latest TikTok challenge
48,nottheonion,High election turnout not always good says Carrie Lam
49,nottheonion,World’s first 'Tesla baby' born as child arrives while car was being driven in autopilot
50,nottheonion,Third graders forced to dig pretend mass graves in Holocaust reenactment — then told 'Jews ruined Christmas'
51,nottheonion,"Watch : Tom Holland aka Spiderman talks about his struggles with dyslexia, his accent, &amp; success as an actor ..."
52,nottheonion,Law prof suggests rewrites of First and Second Amendments that do not mention free press or bearing arms
53,nottheonion,Rise Of the Apes! Monkeys Reportedly Kill 250 Dogs To Take Revenge After Pooches Killed A Baby Monkey
55,nottheonion,2 Monkeys Caught In Maharashtra In 'Revenge Killing' Of 250 Dogs
56,nottheonion,Multi-Millionaire Sues Widow over $15 CD of Music (some of which the Multi Millionaire stole in the first place)
57,nottheonion,Journey cassette mistaken for a bomb causes building evacuation
58,nottheonion,After 4 suicides in a year — 3 by hanging — IISc begins removing ceiling fans in hostel room
59,nottheonion,DCPS investigates after elementary students say they were forced to reenact Holocaust
60,nottheonion,"DC 3rd graders made to reenact Holocaust, told it's 'because Jews ruined Christmas'"
61,nottheonion,Dungeons &amp; Dragons: Wizards of the Coast Removes Problematic Lore
63,nottheonion,Scout leaders apologise to woman who was hounded after calling a bearded man 'he' on social media
64,nottheonion,"In Leavenworth, Christmas skirmish breaks out over rebranding and Krampus Drink Crawl"
65,nottheonion,Emergency announced in Suez Canal as 'Ever Given' container ship returns
66,nottheonion,Real-life quidditch leagues to change Harry Potter sport's name after author's 'anti-trans' remarks
67,nottheonion,Candidate killed by celebratory gunfire shortly after winning election.
69,nottheonion,Portland commissioner set to vote for budget defends herself after second creditor sues her over personal debt
70,nottheonion,Record low turnout for Hong Kong’s first poll under new ‘patriots only’ rules
71,nottheonion,Turnout appears low for Hong Kong election held under new 'patriots only' rules
73,nottheonion,Florida man kicked off flight after trying to wear women's underwear as a face mask
74,nottheonion,Potter's ex-chief: 'I saw no violation' of policy by officer
75,nottheonion,Women executed 300 years ago as witches in Scotland set to receive pardons
78,nottheonion,Ohio police seeking thieves who stole 58-foot bridge
79,nottheonion,Accessories Said to 'Protect Against 5G' Found to Be Radioactive
80,nottheonion,Microsoft can't get hold of retail Xbox Series X consoles for this weekend's Halo tournament
82,nottheonion,Sarah Palin says ‘over my dead body’ will she have vaccine after contracting Covid
83,nottheonion,Sarah Palin says ‘over my dead body’ will authorities make her have a covid vaccine shot
84,nottheonion,"Just open an account and verify, then have unlimited phone sex. more"
85,nottheonion,"""DRACO"" Nanobot uses MRNA ""tags"" to identify cells for destruction"
86,nottheonion,The Vaccine Scientist Spreading Vaccine Misinformation
88,nottheonion,Horseshoe crabs are in danger because everyone wants their blood.
89,nottheonion,Report: Monkeys in India going on deadly rampage against dogs after baby monkey killed
90,nottheonion,Shooting spike cancels Mississippi town's Christmas parade
91,nottheonion,Unisex changing rooms put women at danger of sexual assault
92,nottheonion,Mack Brown and Shane Beamer agree to mayonnaise bath for winner of Duke's Mayo Bowl
93,nottheonion,"Innocent black man, 61, who was jailed for raping author Alice Sebold after she wrongly identified him had NO idea she made millions off the story while he lived in windowless squalor after finishing 16-year jail sentence"
94,nottheonion,Widow ordered to pay thousands for attempting to sell husband's Eric Clapton bootleg
95,nottheonion,Eric Clapton sued a woman who listed a bootleg CD on eBay for $11. She now owes thousands.
96,nottheonion,Eric Clapton sued a woman who listed a bootleg CD on eBay for $11. She now owes thousands
97,nottheonion,"Washington Senator Doug Ericksen, Who Fought Vaccine Mandate, Dies After COVID Battle"
99,nottheonion,"Since the Roll-Out of Covid Injections There’s Been Funeral, After Funeral, After Funeral – “It’s Tragic” Says Vicar’s Wife"
0,nottheonion,Philadelphia woman gives birth in front seat of Tesla on autopilot
1,nottheonion,An elite runner pooped down her leg 7 miles into a marathon but kept going until the end — maintaining a personal-record pace almost the whole way
2,nottheonion,Camels disqualified from beauty pageant over cosmetic enhancements
3,nottheonion,"North Korean Founder Kim Il Sung Did Not Have the Ability to Teleport, State Media Admits - DailyAtomic"
4,nottheonion,Norfolk police tackled a bicyclist for riding without a headlight. Bodycam footage in a lawsuit shows it all.
5,nottheonion,Avatar ‘groped’ in first sexual assault incident in Meta’s metaverse
6,nottheonion,How a grounded hulk is floating everyone’s boat in Vancouver. The stranded boat that broke free of its tethers has become a local celebrity – with tribute T-shirts and its own Twitter account
7,nottheonion,After 4 suicides in a year — 3 by hanging — IISc begins removing ceiling fans in hostel rooms. Thoughts?
8,nottheonion,TIL That during WW2 Heinz invented a self heating soup can that would frequently explode.
10,nottheonion,Two monkeys captured for killing puppies in retaliation in India's Maharashtra
12,nottheonion,"6 years after it was shut down, PlayStation Home has been resurrected by fans"
13,nottheonion,"Necklaces conspiracy theorists wear to 'protect' themselves from 5G are actually radioactive, nuclear experts warn"
14,nottheonion,Woman claims she was virtually ‘groped’ in Meta’s VR metaverse
15,nottheonion,Newcastle Church of Ubuntu sacked woman for getting Covid-19 vaccine
16,nottheonion,WATCH : Tom Holland and Zendaya Kissing in his Car
18,nottheonion,Watch : Why Zendaya Jokingly Called Tom Holland ‘An Idiot’. His Latest Post Sparks Dating Rumors
19,nottheonion,"India: Monkeys Throw Dogs Off Buildings in 'Revenge' Attacks, Report Says"
21,nottheonion,"Anti-5G Pendant Actually Causes Harmful Radiation, Dutch Authorities Warn"
23,nottheonion,Did Tom Holland and Zendaya ever date?
24,nottheonion,Neiman Marcus is selling Non Fungible Tokens of Melania Trump’s cobalt blue eyes
26,nottheonion,It's monke vs doge in India.
27,nottheonion,"Tom Holland Age, Height, Wiki, Bio, News, FAQ"
28,nottheonion,Monkey offered cocaine and flushed down loo recovering
29,nottheonion,Baby driver: Philadelphia woman gives birth in front seat of Tesla on autopilot | Tesla
30,nottheonion,India: 2 monkeys caught for killing puppies
31,nottheonion,Bolo recheado com mousse de limão e leite condensado caseiro
32,nottheonion,2 Monkeys Caught In Maharashtra In 'Revenge Killing' Of 250 Dogs: Report
33,nottheonion,Monkeys in an Indian village have k*lled 250 dogs by dragging them to the top of buildings.
35,nottheonion,Monkeys Kill 80 Puppies in Gang War With Dogs.
40,nottheonion,Beta tester claims she was virtually 'groped' in Meta's virtual reality metaverse
41,nottheonion,CNN guest advises people to wear masks at Christmas whether 'vaccinated or not'
43,nottheonion,2021.12.19晚，小圓子，開播！
44,nottheonion,"Fox News forgets Washington State Senator Dough Ericksen died…Ooh, free puppies and kittens for everyone!"
46,nottheonion,"Fox News forgets Washington State Senator Doug Ericksen died. Instead, we are redirecting you to spoke person for Fox News website"
47,nottheonion,A comprehensive guide - How Americans can resist coronavirus shot mandates!
49,nottheonion,Man Arrested After Robbing Bank and Then Depositing Money Into ATM Outside
54,nottheonion,Local school districts relieved as a Tik Tok threat of 'national shoot up your school day' ends with no shootings
58,nottheonion,GOP gubernatorial candidate’s campaign video celebrates Minnesota with stock images from Eastern Europe
59,nottheonion,At least they wont get that 5G flu.
60,nottheonion,"Intoxicated Driver Escapes Injury from Accident, but gets Knocked Out by his Brother"
61,nottheonion,Kamala Harris lets Charlamagne tha God know who the real President is aka CNN trying to spin some bs lol
62,nottheonion,Kamala Harris lets Charlamagne tha God know who the real President is aka CNN is trying to spin some bs lolololol
63,nottheonion,Alabama man accused of feeding caged 'attack squirrel' meth | Alabama
65,nottheonion,People are paying for KFC to be smuggled through tunnels into Gaza
67,nottheonion,KFC 12 piece buckets have been smuggled through tunnels into Gaza
71,nottheonion,NCIS LA &amp; Amazing Race Actor Arrested On Set For Murder Of 2 Women
72,nottheonion,Xbox Shortages: Microsoft's Own Pro Halo Infinite Tournament Is Using Development Kits For Some Players
75,nottheonion,Murder-for-hire suspect caught after he wrote a positive internet review for one of the alleged hitmen
76,nottheonion,2021.12.19早，老白，開播！
77,nottheonion,Strange 'droning' noise bothering locals for year spreads to village nearby
78,nottheonion,Strange 'droning noise that makes locals' bodies vibrate' spreads to village nearby
81,nottheonion,Mississippi man facing 5 years in prison for shining lasers at planes
82,nottheonion,Cleaner walks out of office after 'mortifying' Elf on the Shelf prank by workers
85,nottheonion,Biden administration reverses Trump rule allowing more powerful shower heads
86,nottheonion,Washington Football Team Planning To Start Plus-Size Male Model Vs. Eagles Due To COVID-19 Outbreak With Team
87,nottheonion,"'Anti-5G' jewelry and accessories are radioactive, Dutch authorities warn"
89,nottheonion,Company Launches Haunting Factory Farm Playset For Christmas
90,nottheonion,Browns' Odell Beckham Jr. on COVID-19: 'I don't think it's going to enter this body...it's a mutual respect'
91,nottheonion,Is Dogecoin the future? How far could this crypto go?
92,nottheonion,Sen. Blumenthal expresses regret for attending Communist awards show
94,nottheonion,Florida man who was kicked off a United Airlines flight over wearing a red thong on his face instead of a face mask compared himself to civil-rights pioneer Rosa Parks
95,nottheonion,"Candy cane shortage fueled by COVID, weak peppermint harvest"
96,nottheonion,Toronto Ice Festival is cancelled due to lack of ice
97,nottheonion,Mi Primer Millon
98,nottheonion,"Scientist Who Trained Rats to Play ""Doom II"" Says He May Start Twitch Channel"
99,nottheonion,WH urges Putin to ‘build back better’ instead of invading Ukraine
1,nottheonion,"""necklaces and accessories claiming to protect people from 5g mobile networks have been found to be radioactive"""
2,nottheonion,"'QAnon Shaman' Jacob Chansley compared himself to Gandhi, Martin Luther King Jr., and Jesus Christ in interview from prison"
3,nottheonion,UN talks fail to open negotiations on ‘killer robots'
4,nottheonion,Louisiana Judge Is Sorry Her Family Had a Blast Calling a Burglar the N-Word
8,nottheonion,Man who carved wooden penis in Wilton resolves case
9,nottheonion,Congressman Asks Colleagues To Demand DEA Allow Psilocybin Treatment For Patients
10,nottheonion,Horrific images show monkeys attacking and killing 250 dogs in India - NZ Herald
11,nottheonion,Bomb collar pizza bank robbery murder solved
14,nottheonion,Guests urged to be vaccinated at anti-vaxxer Robert F Kennedy Jr’s party
16,nottheonion,Nolah Sleep Deals | Free Shipping and Returns on All Orders. | Nolah Sleep Coupons and Deals for December 2021
23,nottheonion,"A troop of monkeys has killed up to 250 dogs in 'revenge' attacks by throwing them off tall buildings, reports from India say"
26,nottheonion,Police on the lookout for thieves who stole entire 58-foot bridge - NewsBreak
32,nottheonion,Thieves steal entire bridge in Ohio
33,nottheonion,"Watch the video Now :‌ Tom Holland, Zendaya, and Jacob Batalon Character Quiz."
35,nottheonion,Russian court accidentally documents Moscow’s military presence in Donbas
36,nottheonion,Scientists keep inventing ways for pigs to breathe via their rectum
37,nottheonion,Classroom Lesbian Orgy
43,nottheonion,Killer monkeys slay 250 dogs by dropping them off buildings in 'revenge' attacks
49,nottheonion,Nevada Man Claimed to Have Proof of Illegal Voting Takes Guilt Plea to Voting Twice
50,nottheonion,What did I just find
51,nottheonion,"U.S. blacklists 34 Chinese entities, citing human rights abuses and ‘brain-control weaponry’"
52,nottheonion,"Storm trapped dozens of people in a remote pub in the U.K., forcing them to endure cold, snow, wind, and an Oasis cover band, for 3 torturous days."
54,nottheonion,"Facebook exposes mercenary spy firms that targeted 50,000 people"
55,nottheonion,Tap intentionally left running in Winnipeg city hall washroom for over a year as employees work from home
57,nottheonion,"Marine Le Pen, notoriously islamophobic french leader, starts meeting with Muslim prayer"
58,nottheonion,Horseshoe crabs are in danger because everyone wants their blood
59,nottheonion,Police in Ohio city seek thieves who stole pedestrian bridge
60,nottheonion,"A man opened his ex- girlfriend's eyelids while she slept to unlock her phone and streal $ 24,000 , report says"
61,nottheonion,Guests urged to be vaccinated at anti-vaxxer Robert F Kennedy Jr’s party | US news
63,nottheonion,da
64,nottheonion,Jessica Henwick didn’t return to Star Wars because Rian Johnson thought her character was dead
65,nottheonion,Monkeys Kill 250 Puppies In Act Of Vengeance After Dogs Kill One Of Their Infants
66,nottheonion,'That title belongs to St. Mary': Mariah Carey renounces 'Queen of Christmas' title as she believes the mother of Jesus is more deserving
67,nottheonion,"Hillary 2024? Given the competition, she may be the Dems' best hope"
68,nottheonion,Tornadoes are coming after the storm !
69,nottheonion,"Man kicked off plane, banned from airline for wearing women's underwear as face mask"
70,nottheonion,Police confused after thieves steal 58-foot-long pedestrian bridge from field
71,nottheonion,"Kyrie Irving has entered the league’s Covid protocols, team says."
72,nottheonion,Maharashtra: Angry monkeys exact revenge by killing 250 dogs after a puppy kills a baby monkey
74,nottheonion,Maharashtra: Revengeful Monkeys Allegedly Kill 250 Dogs After Baby Monkey Gets Killed By Pooches
76,nottheonion,Parents change name of child from Recep Tayyip to Aras after abandoning support for Erdoğan
77,nottheonion,"2 monkeys involved in killing of many puppies captured, to be released in a nearby forest in Nagpur"
78,nottheonion,THIS DUA SOLVE ALL PROBLEM IN SHA ALLAH
80,nottheonion,Century-old game of button football a cult sport in Hungary
82,nottheonion,New research says baboon breakups are mutual
84,nottheonion,Nepal's biggest stupa turns to biodegradable prayer flags
86,nottheonion,Elon Musk Has A Public Mental Breakdown
88,nottheonion,"CANNIBAL CORPSE Drummer On Getting Older And Playing Extreme Metal: ""You Take It Day By Day"""
90,nottheonion,Man kicked off United Airlines flight at FLL for wearing women’s underwear as mask
91,nottheonion,"The Dangerous Rise Of Men Who Won't Date ""Woke"" Women"
92,nottheonion,Quidditch leagues to change sport name because of J.K. Rowling's transphobia
93,nottheonion,Demi Lovato sings to ghosts to help them overcome trauma caused by sexism
95,nottheonion,Kamala Harris interview with Charlamagne Tha God gets heated after he asks who 'real' president is
99,nottheonion,Anti-5G necklaces found to be radioactive - BBC News
0,nottheonion,"Brazilian Soccer Fans Decapitate Ref After He Stabs, Kills Player"
1,nottheonion,NYC COVID inspector booted from bar for failing to show own proof of vaccination
2,nottheonion,"Jail for youth who cheated Carousell buyers of S$37,000, skipped court hearing to celebrate birthday and then cheated other people to pay for birthday"
3,nottheonion,"Pro wrestler uses iron spike to stab referee in head, ‘horrifying’ Texas video shows"
4,nottheonion,College begins removing ceiling fans from hostels to prevent students from attempting suicide
7,nottheonion,After 4 suicides in a year — 3 by hanging — IISc begins removing ceiling fans in hostel rooms
10,nottheonion,"Enraged monkeys kill 250 dogs in revenge after some dogs killed a baby monkey in Maharashtra, India"
11,nottheonion,Austin car dealer murder-for-hire suspect caught after he wrote a positive internet review for one of the alleged hitmen
12,nottheonion,"MrBeast : INVITED 15 CREATORS TO COMPETE FOR $1,000,000 FOR THEIR FANS! Who is MrBeast? How much does MrBeast make a day? Earnings as a YouTuber"
14,nottheonion,minecraft animation
15,nottheonion,Indian Student in jail for the last two months for praising the wrong cricket team.
16,nottheonion,A professor hid a cash prize on campus. All students had to do was read the syllabus
18,nottheonion,"80,000 honey bees and 100 lbs of honey found in shower of Florida home. ""They were nice bees"", said homeowner."
23,nottheonion,Enraged monkeys kill 250 dogs to take 'revenge' after puppy kills baby monkey in Maharashtra's Beed
25,nottheonion,MPs question standards chief over claims PM misled him on flat redecoration
26,nottheonion,watch : The Jonas Brothers are jumping on the latest TikTok trend and they’ve enlisted the president of the United States!
27,nottheonion,Frisky Nikita and Alexa enjoy anal sex with strangers
