index,subreddit,title
79,nottheonion,FBI may shut down police use-of-force database due to lack of police participation
80,nottheonion,I think this speaks for itself…
82,nottheonion,"'Let's go Brandon' boat wins Virginia parade contest, then stripped of award"
83,nottheonion,"'Hot People' Behind Gun Violence Need to Be Jailed, Philly's Former Top Cop Says"
84,nottheonion,"Fall on walk from bed to desk is workplace accident, German court rules"
85,nottheonion,Over 40 camels disqualified from beauty contest after breeders caught injecting them with Botox
86,nottheonion,Saudi camel beauty pageant cracks down on Botox
87,nottheonion,سپر پاکستان نیوز ; لاہور میں گیس کی لوڈشیڈنگ میں اضافہ
88,nottheonion,SAPD Officer Fired After ‘Feces Sandwich’ Incident Loses Second Appeal for His Job
91,nottheonion,"Someone keeps pooping on the floor at Goodwill, police want answers"
93,nottheonion,"Amazon Outage Disrupts Lives, Surprising People About Their Cloud Dependency"
95,nottheonion,Bowser agrees to $10 million fine for selling Nintendo Switch hacks
96,nottheonion,Lori Lightfoot Says Chicago Retailers Aren't Doing Enough to Defend Against Theft
97,nottheonion,Portland City Council Could Consider a Foie Gras Ban in 2022
99,nottheonion,HMS Queen Elizabeth returns to Portsmouth minus £100m fighter jet
0,nottheonion,Camel beauty contest scandal involving Botox and makeup
2,nottheonion,Beijing says the boycotts of its Winter Olympics don't matter because those officials were never invited and nobody will miss them anyway
5,nottheonion,"Suicide pods now legal in Switzerland, providing users with a painless death - National | Globalnews.ca"
8,nottheonion,Saudi camel beauty pageant cracks down on cosmetic enhancements
9,nottheonion,Over 40 Camels Barred From Saudi Beauty Contest Over Use of Botox
10,nottheonion,"Over 40 camels disqualified from Saudi beauty contest over Botox, other artificial touch-ups"
12,nottheonion,'Suspicious' Chef Boyardee can on wheels leads Chicago cops to shut down street
14,nottheonion,FBI transcript says defendants linked to Oath Keepers went to Olive Garden for dinner after ransacking the Capitol on January 6
15,nottheonion,CRYPTO PAYZ - DON'T GET SCAMMED BY FAKE BTC PROMOTERS!
17,nottheonion,Lebron James head found in a jar of Alfredo sauce
18,nottheonion,Biden to decry democracy 'recession' at White House summit
20,nottheonion,Officials: New Jersey mother charged with murder after allegedly stabbing 5-month-old to death
21,nottheonion,Waukesha parade suspect says he feels 'demonized'
22,nottheonion,"NJ mother killed her 5-month-old to ‘fulfill the last of her sins, murder’"
23,nottheonion,Sweden reclaims place names from IKEA
25,nottheonion,China says the boycotts of its Winter Olympics don't matter because those officials were never invited and nobody will miss them anyway
27,nottheonion,Saudi authorities disqualify more than 40 contestants from a camel beauty pageant for using Botox
28,nottheonion,Billionaire CEO of Better.com Fires 900 Employees Over Zoom
30,nottheonion,Jussie Smollett Asks Prosecutor To Stop Saying N-Word While Quoting His Text Messages | The Daily Wire
32,nottheonion,Better.com’s CEO Called Workers ‘Dumb Dolphins’—Three Executives Quit
33,nottheonion,Watch : BTS’s Jimin Makes SoundCloud History As “Promise” Becomes 1st Song Ever To Surpass 300 Million Streams
34,nottheonion,"Dozens of camels barred from Saudi beauty contest over Botox, touch-ups"
35,nottheonion,Dozens of camels barred from Saudi ‘beauty’ contest over Botox
37,nottheonion,"Sen. Wicker: Don’t Rule Out Hitting Russia With Nukes, Ground Troops"
38,nottheonion,Joe Biden should consider nuclear strike on Russia over Ukraine—GOP Senator
39,nottheonion,"""We May Need Fourth Covid Dose Sooner Than Expected"""
40,nottheonion,"Tucker Carlson sides with Putin over Ukraine, right to defend borders"
41,nottheonion,"Tucker Carlson sided with Putin over Ukraine, saying Biden is wrong to try to stop a Russian invasion"
42,nottheonion,Botox-injected camels barred from Saudi Arabia beauty contest
43,nottheonion,Corruption in the Camel Beauty industry!
44,nottheonion,Saudi camel beauty pageant clamps down on Botox cheats
45,nottheonion,Finnish PM apologises for staying out clubbing despite Covid exposure
46,nottheonion,"Germany: ""Commute"" from Bed to Homeoffice accident-insured by law"
48,nottheonion,New Japanese capsule toys answer question: What if bread had legs?
50,nottheonion,Local man makes living out of getting beaten up
51,nottheonion,Turkish man earns living by getting beaten up
52,nottheonion,German teacher killed family with fake handgun over fake vaccine pass
53,nottheonion,CIA director says Russia and Iran turned his hair gray
54,nottheonion,The Collapse Of Civilisation And The New World | Richard Grannon Seminar...
55,nottheonion,"I shouldn’t have been on the bench hearing sexual harassment case against me: Ex-Chief Justice of India, Ranjan Gogoi"
56,nottheonion,Pope Francis says extramarital sex sins aren't that 'serious'
58,nottheonion,More than 40 camels disqualified from a beauty pageant over Botox injections
59,nottheonion,U.S. accuses El Salvador of cutting secret deal with MS-13 to tamp down killings
60,nottheonion,It 'does not mean anything': Hong Kong's Carrie Lam says low election turnout may mean gov't is credible and doing well
61,nottheonion,Camels disqualified for using Botox in beauty competition
62,nottheonion,Your Very First Fisher-Price Phone Now Works With Bluetooth
63,nottheonion,That time the US literally just dumped $12 billion in cash in the middle of the Iraqi desert
65,nottheonion,Misspelling on I-95 exit sign in Delaware gets covered up
67,nottheonion,"Camel beauty contest sees 40 disqualified for Botox, other cosmetic procedures"
68,nottheonion,LIVING ROOM CHURCH
69,nottheonion,"Oregon governor signs bill to end reading, math proficiency requirements for HS graduation"
70,nottheonion,Oregon governor signs bill ending reading and math proficiency requirements for graduation
71,nottheonion,"Pantone unveils Very Peri, a periwinkle hue as color of the year for 2022"
72,nottheonion,Expansions for the Europa Universalis board game have already been planned
73,nottheonion,"Man, 67, charged after stopping in intersection to eat chicken wings"
74,nottheonion,"Company weeds out competition, bakes 850-pound pot brownie"
75,nottheonion,"Toddler dies, brother undergoes life-saving surgery after ‘botched circumcisions’ in Perth"
77,nottheonion,MISSPELLING ON I-95 EXIT SIGN IN DELAWARE GETS COVERED UP
80,nottheonion,Pakistan Railways Suspends Two Train Drivers After They Stopped Train to Buy Yogurt
83,nottheonion,Finnish PM apologises for staying out clubbing despite Covid exposure | Finland | The Guardian
84,nottheonion,Vì sao nách có mùi hôi Nguyên Nhân &amp; Cách trị hôi nách
85,nottheonion,850 Pound Pot Brownie!
86,nottheonion,Woman accused of urinating in front of Limestone County deputies after stolen mail found in pockets
91,nottheonion,California school district reportedly encourages using witchcraft on people who say 'all lives matter'
92,nottheonion,"Camels kicked out of beauty pageant for using Botox, lose $66M prize"
94,nottheonion,40 Camels disqualified from beauty pageant for botox use
95,nottheonion,"Suicide pods now legal in Switzerland, providing users with a painless death"
96,nottheonion,Navy SEAL commander dies after weekend training accident in Virginia
97,nottheonion,Over 40 camels disqualified in Saudi Arabia beauty contest for using Botox
98,nottheonion,"Texan Substitute Teacher Let Go After Singing Britney Spears' ""Toxic"" for His Students"
0,nottheonion,Congressman mockingly mentions 'Mongoose Coin' at cryptocurrency hearing so someone launched Mongoose Coin
2,nottheonion,Sick Scarborough paedophile wore chastity belt to stop abusing children but it did not prevent sex act with dog
3,nottheonion,Family awarded $301 billion from bar that overserved drunk driver in largest penalty ever
4,nottheonion,Driver halted train to buy yogurt
6,nottheonion,Instagram head says it’s bringing back the chronological feed
8,nottheonion,Finland's Prime Minister Very Sorry for Going Clubbing Until 4am After Covid-19 Exposure
9,nottheonion,Log into Facebook
10,nottheonion,Tennessee medical board takes virus misinformation policy offline
11,nottheonion,Black Lives Matter stands in solidarity with Jussie Smollett: ‘We can never believe police’
13,nottheonion,Camels enhanced with Botox barred from Saudi beauty contest | Saudi Arabia
16,nottheonion,Write-in vote joke lands Lower Paxton Township man seat as an elected official
17,nottheonion,"All-white jury votes to convict Black defendant in room with Confederate flag, new trial ordered"
18,nottheonion,"Plumber who discovered money in wall of Joel Osteen's Lakewood Church gets $20,000 reward"
20,nottheonion,TTC worker heroically guards escalator that somebody pooped on
22,nottheonion,Opinion: Ghislaine Maxwell's defense is to blame the victims
23,nottheonion,Fox News Christmas tree set on fire in Midtown Manhattan; suspect identified
24,nottheonion,Camel causes chaos after fleeing Kansas nativity scene
27,nottheonion,Dozens of camels barred from Saudi ‘beauty’ contest over Botox | Wildlife News
28,nottheonion,"Woman jumps into Bronx Zoo lion exhibit, tells animal ‘I love you’ while holding roses and throwing $100 bills"
30,nottheonion,Dozens of camels barred from competing in Saudi Arabia beauty contest over use of Botox
31,nottheonion,Saudi Arabian beauty pageant disqualifies camels cosmetically enhanced with botox
33,nottheonion,Camels kicked out of $66M beauty pageant for using Botox
34,nottheonion,Instagram strikes the Camel world
36,nottheonion,Oklahoma state senator wants to name three inches of ‘desolate highway’ after Lincoln Riley
38,nottheonion,Giant Study Finds Viagra Is Linked to Almost 70% Lower Risk of Alzheimer's
41,nottheonion,Canada military’s former head of HR charged with sexual assault
44,nottheonion,Camel Beauty Contest Rocked By Botox Scandal
45,nottheonion,Barkley reveals he named daughter after a local mall
47,nottheonion,Boss says sorry for 'blundered' Zoom firing of 900 staff
48,nottheonion,Large California school districts eliminate ‘D’ and ‘F’ grades
49,nottheonion,Sanna Marin: Finland's PM sorry for clubbing after Covid contact
50,nottheonion,Some Jan. 6 Rioters May Use Police Brutality as a Defense
51,nottheonion,"Visitor to Singapore Botanic Gardens 'bitten 26 times' by otters; such incidents rare, says Gardens"
52,nottheonion,Column: Is a 'Viva Mexico' salad Mexican food? A judge will soon tell us
53,nottheonion,You could not make this shit up: Brazilian President Jair Bolsonaro wins TIME’s 2021 Person of the Year reader poll.
54,nottheonion,Definition of 'Mexican' Food to Be Decided by Nevada Judge in Dispute Over Chopped Salads
56,nottheonion,Two Dacron Women feared missing in Volcanic Disaster
57,nottheonion,New Mexico State to drop parking citations for peanut butter | AP News
59,nottheonion,"Tucker Carlson Sides With Putin Over Ukraine, Right to Defend Borders"
61,nottheonion,Turnout meaningless but please vote anyway
62,nottheonion,Turnout meaningless but please vote anyway: CE
65,nottheonion,Camels enhanced with Botox barred from Saudi beauty contest
67,nottheonion,"Missouri officials planned to thank Post-Dispatch before threatening newspaper, emails show"
68,nottheonion,German convicted of castrating men on his kitchen table | AP News
69,nottheonion,Scientists Developed a Questionnaire to Identify Whether Your Cat Is a Psychopath
72,nottheonion,Some snakes 'likely' survived accidental Maryland house fire in attempt to get rid of them
73,nottheonion,"“Pay 99 Cents To Make Mario Jump Higher,” Hedge Fund Urges"
74,nottheonion,Colorado man sets mom’s home ablaze trying to clear cobwebs with blowtorch.
75,nottheonion,Saskatchewan premier calls for end to 'stigmatizing the unvaccinated'
79,nottheonion,France releases Khashoggi suspect after realising they mistook his identity
81,nottheonion,The Taliban are attempting to appeal to western audience and learn about feminism and trans rights (video)
82,nottheonion,Camels banned from Saudi Arabia beauty contest after being found to have had facelifts and Botox
83,nottheonion,Boss says sorry for 'blundered' mass Zoom firing
84,nottheonion,Broadcasters Cancel Curling Stream Over Sex Toy Sponsorship
85,nottheonion,CAMEL-flage: Saudi authorities have conducted their biggest crackdown on camel beauty contestants that received Botox injections and other artificial touch-ups. Over 40 camels disqualified from the annual pageant.
86,nottheonion,AP Oddities on Twitter
90,nottheonion,"Man arrested over Jamal Khashoggi killing was a case of mistaken identity, French authorities say"
91,nottheonion,The 10 most popular TikTok clips in the UK . Who is Viral TikTok superstar Mia the cat !
92,nottheonion,WATCH: Train Driver Stops To Buy Yogurt From A Shop On The Outskirts Of Lahore
93,nottheonion,"'Mystery Hut' spotted on the moon by Chinese rover is just a rock, scientist says"
96,nottheonion,Dozens of Camels banned from beauty contest due to Botox
97,nottheonion,George Orwell's estate approves retelling '1984' from woman's point of view
98,nottheonion,New Fort Myers Beach t-shirt shop causing big controversy over name
99,nottheonion,Family reaches $301 billion verdict in trial against local bar
0,nottheonion,China publishes white paper on its democracy | NHK WORLD-JAPAN News
2,nottheonion,"When Scammers Get Scammed, They Take It to Cybercrime Court"
3,nottheonion,"'Possessed' woman, 28, undergoes nine-hour exorcism to rid her of 'the devil' after she attacked Italian priest during confession and started speaking Latin in three different voices"
4,nottheonion,Telegram has added content protection support to enable users to block others from saving or forwarding posts shared in groups and channels
6,nottheonion,Man Arrested for Torching Fox News Christmas Tree
7,nottheonion,Woman shocked to find her guinea pig has eaten her fringe while she slept
8,nottheonion,"War with Russia in air, Ukraine is shitposting memes on Twitter"
9,nottheonion,Fish ‘whoops and growls’ recorded on restored reef
10,nottheonion,Fish âwhoops and growlsâ recorded on restored reef
11,nottheonion,"In Today's News, A Woman Continued Breastfeeding Her Cat On A Plane, Despite Requests To Stop"
12,nottheonion,Tesla’s in-dash video games can be played even while driving
13,nottheonion,Dozens of camels barred from Saudi beauty contest over Botox
14,nottheonion,Switzerland legalises 3D-printed portable suicide capsules
15,nottheonion,Norway Covid omicron Outbreak at an Oslo Christmas party
16,nottheonion,Jenna Ryan Jan. 6 rioter is eager to enjoy prison weight loss and yoga program
17,nottheonion,"when is EXO Birthdays ? Exo Members : Xiumin, Suho, Lay, Baekhyun, Chen, Chanyeol, D.O., Kai and Sehun."
18,nottheonion,"Jenna-Ryan: Prison is great for detox, yoga, &amp; smoothies"
19,nottheonion,"Plumber who found cash stashed in wall of Joel Osteen's church getting $20,000 reward"
20,nottheonion,Half of Amsterdam cab drivers tied up in criminal cases since 2018
21,nottheonion,"Viral Video: Bride's Ex Gatecrashes Wedding In Uttar Pradesh, Applies Sindoor In Front Of Groom"
22,nottheonion,Sandy daycare shut down after police find meth during search for child porn
23,nottheonion,Asking for 'Change' in Karnataka Buses Can Land You Behind Bars for 3 Years
24,nottheonion,Better.com’s Boss To Employees “Happy Holidays… You’re Fired!”
26,nottheonion,Bluetooth Earphones with Mic for Secure Sports Fit
27,nottheonion,Pastor who performed in drag on HBO's 'We're Here' leaves church
29,nottheonion,Wisconsin’s Omicron Family Restaurant embraces name with ‘corona’ shirts
30,nottheonion,Newest COVID variant shares name with Wisconsin restaurant
31,nottheonion,China counters boycott with claim US wasn’t even invited to Olympics anyway
32,nottheonion,Study Finds Viagra Usage Could Reduce Alzheimer's Risk by 70 Percent
33,nottheonion,"Man who claims he invented Bitcoin wins trial, keeps Bitcoins worth $50B"
35,nottheonion,"Cookie-flavored wine coming soon from Oreo, Barefoot Wine"
36,nottheonion,Oreo Is Teaming Up with Barefoot Wine for a Cookie-Flavored Red Blend
37,nottheonion,US billionaire surrenders $70m of stolen art
38,nottheonion,NBC Cancels Stream of Olympic Curling Qualifying Over Sex Toy Sponsorship
39,nottheonion,You can now play video games on a Tesla screen when the car is in motion
41,nottheonion,Viagra reduces Alzheimer’s risk by 69%
42,nottheonion,Florida to feed starving manatees in rare conservation move
43,nottheonion,Massachusetts-based cannabis operator unveils ‘world’s largest’ pot brownie
44,nottheonion,MariMed Unveils World’s Largest Cannabis-Infused Brownie to Celebrate Launch of Its “Bubby’s Baked” Brand
46,nottheonion,Spanish town until recently called Fort Kill the Jews hit with antisemitic graffiti
47,nottheonion,Only true zero COVID country? Sealand 'micronation' stands proud
48,nottheonion,Australians to create 'black box' to hold world accountable for climate crisis
51,nottheonion,Staffer of an Australian MP dresses as Kyle Rittenhouse for delayed Halloween party
53,nottheonion,Oxford school shooting: Ethan Crumbley appointed lawyer by court after his parents only hired their own
54,nottheonion,NYC anime convention may offer 'earliest looks' at Omicron spread in US
55,nottheonion,Well now we need to push back the parallel universe switch theory from 2012 to 2009 🤣😂
56,nottheonion,"Military's former head of HR charged with sexual assault, indecent acts | CBC News"
57,nottheonion,Matt Lauer Is Supporting Chris Cuomo After Sexual Misconduct Claim And CNN Firing
58,nottheonion,Vishal Garg: CEO of Better.com apologises for firing 900 employees over Zoom call
60,nottheonion,"when is BTS Members birthdays in order ? BTS Members : RM, Jin, Suga, J-Hope, Jimin, V and Jungkook."
61,nottheonion,TIL the Large Hadron Collider had to be turned off for a period of time because a bit of baguette was found in it.
62,nottheonion,"Taking Viagra slashes the risk of Alzheimer's by up to 69%, study suggests"
63,nottheonion,Nintendo Switch hacker Gary Bowser must pay Nintendo $10m on top of his $4.5m fine
64,nottheonion,"Avoiding trial, a former hedge fund manager turns over $70 million in stolen antiques"
65,nottheonion,"A Flaky Croissant-Shaped Bubble Surrounds Our Solar System, Scientists Say"
67,nottheonion,Company offers assisted-suicide pod in Switzerland that claims to offer 'painless death'
68,nottheonion,Hadron Collider had to be turned off for a period of time because a bit of baguette was found in it.
69,nottheonion,68 ICU nurses tested positive for COVID-19 after going to their hospital Christmas party
70,nottheonion,Downing Street staff shown joking in leaked recording about Christmas party they later den
71,nottheonion,Nets’ Kyrie Irving might be swayed to take plant-based COVID vaccine in works
73,nottheonion,"God entered into my body, as a ghostly body, and begins ripping my face, shoots gum disease in mouth"
74,nottheonion,"Canadian Military's former head of HR charged with sexual assault, indecent acts | CBC News"
75,nottheonion,Pacific Ocean garbage patch is immense plastic habitat
76,nottheonion,Elon Musk Calls for End to Government Subsidies Now That They’ve Made Him Rich
77,nottheonion,Mark Meadows Was 'Nervous' When He Saw Trump's Diet Coke Button
78,nottheonion,Hacker named Bowser must pay Nintendo in piracy case
79,nottheonion,Canada forced to use emergency reserve amid maple syrup shortage
80,nottheonion,Prince Harry: Quit your job if it doesn't bring joy
82,nottheonion,Prince Harry says quitting can be good for your mental health
83,nottheonion,Viagra users are 69 % less likely to get Dementia
84,nottheonion,Prince Harry says quitting your job can be good for your mental health
85,nottheonion,Afghanistan: Top UK official regrets holiday as country fell to Taliban
86,nottheonion,The Taliban Thinks Banning Forced Marriage Makes Men and Women Equal. It Doesn’t. — VICE
87,nottheonion,Sarah Ferguson Says She’s ‘The Most Persecuted Woman In The History Of The Royal Family’
88,nottheonion,"A novelist says fake editions of his works were listed on Amazon as centuries old, with one $7 book going for $1,008"
89,nottheonion,"Afghan museum reopens, with Taliban security"
90,nottheonion,THIS WILL FIX ALL PROBLEMS AND GRANT YOU ALL GOODNESS
91,nottheonion,Vishal Garg: US boss fires 900 employees over Zoom
92,nottheonion,"Colorado leads nation in “dog-poo complaints,” study finds"
94,nottheonion,New trial ordered for Black man whose jury deliberated in room with Confederate flag
95,nottheonion,Pastor Who Appeared In Drag On HBO’s 'We’re Here' Has Been Fired From His Church
96,nottheonion,"Sex toy sponsorship was too racy for curling crowd, promoter says — ESPN"
97,nottheonion,"The internet is not impressed with Chanel's $1,025 advent calendar"
98,nottheonion,West Side Story: Spielberg film 'not showing in Gulf' due to transgender character
99,nottheonion,US company Better.com fires 900 employees on Zoom call
0,nottheonion,Is math education racist? Debate rages over changes to how US teaches the subject
3,nottheonion,Syracuse man pleads to murder after hearing Family Guy’s ‘Stewie’ would be used against him at trial
4,nottheonion,Bowser ordered to pay Nintendo $10 million in damages
5,nottheonion,"Britain Refuses to Return Sacred Religious Tablets to Ethiopia, Best Offer Is a Loan"
6,nottheonion,Did The Grammys Finally Get It Right…Or Is It Just Stockholm Syndrome?
7,nottheonion,Elon Musk thinks you should die
8,nottheonion,Bowser Agrees To Pay Nintendo $10 Million In Hacking Lawsuit
11,nottheonion,A substitute teacher sang Britney Spears' 'Toxic' on a karaoke machine. He was asked to leave early.
13,nottheonion,Get us to 1000 views! Share share share
14,nottheonion,Woman reportedly breastfed pet cat on board Delta flight
15,nottheonion,Court orders Australian dude to pay real $100 million out of imaginary $50 billion stash he does not control
16,nottheonion,Transgender Swimmer Lia Thomas Is Destroying Records At Penn And Aiming To Make History
17,nottheonion,"Viagra could be used to treat Alzheimer’s disease, study finds | Alzheimer's"
18,nottheonion,"Biden Administration Rejects Calls for Ban on ""Killer Robots"""
19,nottheonion,Game studio accuses real-life gun manufacturer of stealing weapon design
21,nottheonion,Bachelor Clayton Echard Tells 3 Women He’s in Love. he had sex. Clayton Echard Tells Contestants He’s Slept with Both of Them in World’s Horniest ‘Bachelor’ Trailer
22,nottheonion,Texas ISD preemptively pulls 400 books 'out of an abundance of caution'
23,nottheonion,Tesla Drivers Can Now Play Video Games Even With Car Moving
25,nottheonion,Tesla Drivers Can Now Play Video Games with Car Moving
26,nottheonion,Terrifying video shows mom set hair on fire blowing out birthday candles
27,nottheonion,Rockstar Announces They’ve Fixed GTA Trilogy by Adding Microtransactions
28,nottheonion,Elon Musk says ‘civilization is going to crumble’ if people don’t have more children
29,nottheonion,Volunteer Dies After a Sheep Charges at Her on an animal Therapy Farm
30,nottheonion,When you don't understand Humans or animals.
31,nottheonion,Ghislaine Maxwell stares at the courtroom artist and sketches her right back
32,nottheonion,GOP Michigan education official: State should end required school attendance After Oxford Shooting
34,nottheonion,"Watch : Billie Eilish Male Fantasy : The official music video for “Male Fantasy”, directed and edited by Billie"
36,nottheonion,"Teen beheads pregnant sister over love marriage, allegedly clicks selfie with head"
37,nottheonion,The 19-year-old victim was reportedly attacked for marrying without her family’s consent. Her mother and brother are said to have proudly put her head on display afterwards.
38,nottheonion,Mom Helped Son Behead His Pregnant Sister Before He Posed for a Selfie: Cops
39,nottheonion,69% reduction in Alzheimer’s with Viagra use….nice
40,nottheonion,SUICIDE MACHINE THAT CAN BE CONTROLLED BY BLINKING FACES ‘NO LEGAL ISSUES’ IN SWITZERLAND
41,nottheonion,"Chef pulls down mask to taste his dish, gets fined."
42,nottheonion,'It hurts my spirit': Search underway for someone who stole Salvation Army red kettle
43,nottheonion,China claims to have ‘democracy that works’ ahead of Biden summit
44,nottheonion,Florida Man Arrested for Allegedly Tossing Alligator Into Wendy's Drive-Thru Window
46,nottheonion,Assisted suicide pod approved for use in Switzerland
47,nottheonion,3D-printed coffin-like ‘suicide capsules’ that can be ‘towed anywhere for death’ are legalised in Switzerland
48,nottheonion,QB Mac Jones on Patriots seize control of AFC with win over Bills. Top 3 things we learned from Bills vs. Patriots
49,nottheonion,Volunteer at therapy farm dies after getting rammed by sheep
50,nottheonion,Volunteer Dies After a Sheep Charges at Her on a Therapy Farm
51,nottheonion,"""Hong Kong people about to enjoy real democracy"" said Director of Beijing's Hong Kong and Macau Affairs Office"
52,nottheonion,"Luxury brand Chanel roasted online for $1,025 Advent calendar full of stickers, other trinkets"
53,nottheonion,Can you fake Telegram members? Why You Should Not Buy Telegram Fake Members for your Channel
54,nottheonion,"Brooklyn artist selling audio of a FART as an NFT for $89, or a 52-minute mash-up for almost $200"
55,nottheonion,Proposed India Bill Banning Crypto Payments Could Mean Jail for Violations -Document | Technology News | US News
56,nottheonion,"Proposed Indian bill banning Crypto payments, it could mean jail without warrant and bail."
