index,subreddit,title
1,nottheonion,French burn fewer cars on New Year’s Eve due to pandemic | Coronavirus pandemic News
3,nottheonion,This is how an earthquake of magnitude 6 was recorded that shook the east coast of Taiwan - 24 Happenings
4,nottheonion,Advices to a Business Trip to Brazil
7,nottheonion,Watch Music Video : SEVENTEEN’s Woozi ‘Ruby’. The all-English Track marks Woozi’s first Official Release as a Solo Artist
10,nottheonion,States bus unhoused people around for metrics instead of dealing with houselessness
12,nottheonion,Georgia Judge Accidentally Bans Elf On The Shelf
14,nottheonion,Woman marries the color pink in historic Vegas wedding
15,nottheonion,"Is Miley Cyrus in a Relationship Now? Pete Davidson, Liam Hemsworth or Cody Simpson?"
16,nottheonion,Kilgore police warn people in south loop area about possible loud booms
19,nottheonion,"Woman swaps out roommate's food with vegan alternatives, ends up charged with a felony"
21,nottheonion,Former Trump adviser Peter Navarro is promoting an election fraud board game
22,nottheonion,"Ghislaine Maxwell's husband told her in a prison phone call that he had 'moved on' with another woman, ending their secretive marriage: report"
23,nottheonion,Omarion sick of bring Omicron
24,nottheonion,Newborn baby found in toilet bin of Air Mauritius plane
25,nottheonion,"Lithuania pays migrants €1,000 to return to Iraq"
33,nottheonion,"Taliban officials dump 3,000 litres of alcohol into canal in booze crackdown"
34,nottheonion,How do you get infinity weapons? We build a New Ranged Infinity Weapon in Minecraft
35,nottheonion,Emojis used frequently in the drug trade have been identified - 247 News Bulletin
36,nottheonion,The brutal attack of a police dog in the demonstrations against the anti-covid restrictions - 24 Happenings
37,nottheonion,Dutch police released dogs on protesters - 247 News Bulletin
38,nottheonion,Jair Bolsonaro urgently hospitalized for probable intestinal obstruction - 24 Happenings
39,nottheonion,A fire completely devoured the seat of Parliament in South Africa - 247 News Bulletin
40,nottheonion,"991 houses burned in the fire in the USA, 3 people are missing - 247 News Bulletin"
41,nottheonion,No escape: women attacked in Afghanistan begin to run out of shelters - 247 News Bulletin
42,nottheonion,Ivanka Trump asked her father to stop the assault on the Capitol - 24 Happenings
43,nottheonion,"Kim prepares North Korea for ""a life and death struggle"" in 2022 - 24 Happenings"
44,nottheonion,"Cats caused more than 100 house fires in the past 3 years, South Korea officials say"
45,nottheonion,India is investigating a fake website that offered Muslim women for sale
47,nottheonion,THE WAR HAS BEGUN
48,nottheonion,Shatta Wale Insults Nigerian Artiste And Burna Boy Reacts
49,nottheonion,SpaceX Starlink Dish 'Snow Melt Mode' Warmth Attracts Cats
50,nottheonion,Man who allegedly drove up to medical centre claiming he has explosives handed more charges
51,nottheonion,"Singer Omarion reacts to Omicron jokes: “I am an artist, not a COVID variant” — NME"
52,nottheonion,"Afghan agents pour 3,000 litres of alcohol into Kabul canal amid crackdown"
54,nottheonion,"Antonio Brown Thanks Bucs for Opportunity on IG, Then Releases New Rap Song"
55,nottheonion,A purrfect crime: Cats behind dozens of fires in South Korea
57,nottheonion,Verified PayPal Account - 100% Verified Real Documents
59,nottheonion,O.J. Simpson Says Antonio Brown’s Actions Are ‘Inexcusable’ &amp; ‘Total BS’
61,nottheonion,Venice will replace a multimillion-dollar footbridge made of glass and steel and designed by the star architect Santiago Calatrava after too many tourists slipped on it.
63,nottheonion,Russia: Strategy of the absurd
64,nottheonion,"TIL In 1993 a French man driving a Citroen car in a remote area of the Moroccan desert had a breakdown and became stranded. To survive he tore down the car, built a motorcycle from the parts, and rode it back to civilization. When he arrived he was ticketed for operating an illegal vehicle."
66,nottheonion,Drunk boy (14) with 1.29 per mille drove drunk father (46)
68,nottheonion,Whistleblower warns baffling illness affects growing number of young adults in Canadian province
70,nottheonion,PAM &amp; CRAIG
71,nottheonion,"Anti-Vax Leader Traveling Country With Guns, Flamethrower, and Fake Badge in Quest to Arrest Dem Governors"
73,nottheonion,France logs decline in torched cars on New Year's Eve
74,nottheonion,"Omarion: 'I Am an Artist, Not a COVID Variant'"
76,nottheonion,Scott Morrison says he won't 'undercut' businesses by funding free rapid antigen COVID-19 tests
77,nottheonion,Christina Couple Maintains Abstinence Two Years After Marriage
79,nottheonion,Pope scraps New Year's Nativity visit over Covid fears - UCA News
81,nottheonion,"Omarion Speaks Out: 'I Am an Artist, Not a COVID Variant'"
82,nottheonion,Breana Noojin Nix Case
84,nottheonion,"Texas Asks FEMA For More Federal COVID Testing Sites, Medical Personnel, Antibody Treatments"
85,nottheonion,"Yes, 2/22/22 is on a Tuesday"
86,nottheonion,TIL: McDonald's did away with their spoon-shaped coffee stirrers because people were using them as cocaine spoons.
88,nottheonion,"IRS reminds people they must report stolen goods, drugs on tax forms"
89,nottheonion,ASUU Strike Recent Updates
90,nottheonion,Woman jumps into zoo's monkey enclosure to feed them Hot Cheetos
91,nottheonion,Korean-American News Anchor Michelle Li Criticized by Viewer for ‘Being Very Asian’ On Air
93,nottheonion,A Reporter Is on Trial for Using 'View Source' Function on a Website
94,nottheonion,Two NFT copycats are fighting over which is the real fake Bored Ape Yacht Club
95,nottheonion,OpenSea bans NFT projects selling flipped Bored Ape Yacht Club avatars
97,nottheonion,"A 23-year-old woman from Weston survived one car crash on Interstate 95 near Boca Raton shortly after midnight Saturday only to be killed in another as she stood beside her car, according to the Florida Highway Patrol."
98,nottheonion,5-Year-Old Dog Elected As Mayor Of Littleton
99,nottheonion,Woman questions if she needs to apologise after boyfriend accuses her of ‘tricking’ him into eating vegan
0,nottheonion,Evidence Mounts That Porn Doesn't Cause Erectile Dysfunction
1,nottheonion,"Mr. Mainak Mondal, 3rd year ECE department student of IEM Kolkata invented “Anti Raping Gloves”"
2,nottheonion,"Singer Omarion Speaks Out: 'I Am an Artist, Not a COVID Variant'"
3,nottheonion,Arizona tells Supreme Court innocence isn’t enough in death row arguments.
4,nottheonion,She’s being very Asian’: Viewer complains after Korean-American news anchor mentions dumpling soup on-air
5,nottheonion,Korean American News Anchor Michelle Li Criticized by Viewer for ‘Being Very Asian’ On Air
7,nottheonion,Scottish 'witches' in line for apology hundreds of years after being burned at the stake
8,nottheonion,"Omarion: “I am an Artist, Not a Covid Variant.”"
9,nottheonion,Giants' -10 passing yards was worst total in an NFL game since Ryan Leaf's 1998 Chargers — NBC Sports
10,nottheonion,Many Latin American countries now among those with highest rates of vaccination
11,nottheonion,"Omarion: ‘I Am an Artist, Not a COVID Variant’"
13,nottheonion,Sweet repeat: Brothers regift same hard candy for decades
15,nottheonion,Kim' Weight Loss Journey
16,nottheonion,Storm rains bushels of fish on Texarkana
17,nottheonion,Michael Saylor live?
19,nottheonion,South Korean Officials Warn That Cats Have Been Starting Fires By Turning On Stoves
20,nottheonion,Elon Musk's Starlink Internet Dishes Are Attracting Cats
21,nottheonion,"E-scooter rider, 74, dies in crash with parked cars"
22,nottheonion,"Antonio Brown leaves field in middle of Buccaneers' game vs. Jets, Bruce Arians says he's 'no longer a Buc'"
24,nottheonion,Social Community Worldwide Global
25,nottheonion,Scientists Have Finally Figured Out Why Swiss Cheese Has Holes | Smart News
26,nottheonion,British bank Santander accidentally pays out $175 million to customers
27,nottheonion,French Burn Fewer Cars Than Usual On New Year's Eve Due To Pandemic
28,nottheonion,Who is Ethan Schmidt? Arizona anti-masker harasses wig shop serving cancer survivors for mask rule
29,nottheonion,Nurse saved from Covid coma by Viagra after 45 days in hospital fighting virus
30,nottheonion,Is Jisoo of K-pop Blackpink a Christian Dior Fashion Ambassador?
32,nottheonion,South Korean crosses DMZ in rare defection to North Korea
33,nottheonion,Rapist cries in court after victim describes his penis as 'small'
34,nottheonion,"In Oklahoma, alligators turn into ‘popsicles’ that protrude from the frozen water"
35,nottheonion,"David Koenig, MMA fighter who lasted almost two years missing, was found dead"
36,nottheonion,"Capitol rioters’ tears, remorse don’t spare them from jail"
39,nottheonion,Melbourne man sets himself on fire over jab mandates
40,nottheonion,Teen reunited with pet rooster lost at Alabama Cracker Barrel after Civil War reenactment
41,nottheonion,South Korean crosses demilitarised zone in rare defection to North | North Korea
42,nottheonion,"The Taliban ordered shop mannequin beheadings, saying the dummies are 'idols' and are forbidden by Islam, reports say"
43,nottheonion,"California high school students disciplined over swastika photos, superintendent says"
44,nottheonion,Minneapolis so cold that NHL is warming ice for Winter Classic
45,nottheonion,The Bucharest Hangover: Drunk Irishman breaks into Romania’s Parliament Palace
47,nottheonion,Without longhaul truckers this country stops
48,nottheonion,Green zone: the US soldiers fighting for vegan food | US military
49,nottheonion,Police discovered illegal orgy between 70 people because two assistants went to the wrong house
50,nottheonion,Quebec unlocks world's only maple syrup strategic reserve to keep pancake lovers happy
51,nottheonion,RZA Shares New EP of Guided Meditation Songs
52,nottheonion,r/notthebunion Fashion for Pointy Shoes Unleashed a Wave of Bunions in Medieval England
53,nottheonion,r/notthebunion Fashion for pointy shoes unleashed a wave of bunions in medieval England
54,nottheonion,R/notthebunion
56,nottheonion,Adams calls 911 to report assault on first day as New York mayor
57,nottheonion,I’m a UK Covid scientist. Here’s a sample of the abuse in my inbox
58,nottheonion,"UK Queen breaks tradition, gives James Bond actor Daniel Craig British honor reserved for real-life spies"
59,nottheonion,"Quebec backtracks, plans to allow dog-walking after curfew"
60,nottheonion,5-year-old basset hound elected mayor of Colorado town
61,nottheonion,Watch : Girls on Top Step Back + Lyrics. GOT the beat ‘Step Back’ Stage Video
62,nottheonion,Online investors look to Tungsten Cubes as newest investment
63,nottheonion,California Woman marries the color pink in historic Las Vegas wedding
65,nottheonion,Woman bites woman in fight over dog discipline
66,nottheonion,"Prepare for right-wing U.S. dictatorship before 2030, scholar urges Canada"
67,nottheonion,"Georgia county looks to close polling sites, have 1 location"
68,nottheonion,Unidentified person crosses heavily militarized border from South Korea to North
69,nottheonion,"Man accidentally stabs himself in back with sword, Pasco officials say"
71,nottheonion,Seattle Kraken fan called a hero after noticing Canucks staffer's cancerous mole during game
73,nottheonion,"Credit cards go vertical, ditching classic look and magnetic strip"
74,nottheonion,Japan's cybersecurity minister who doesn’t use computers now admits he doesn’t get cybersecurity either
75,nottheonion,Odisha (India) Cop Suspended for Stealing Goat for New Year’s Feast Held in Police Station
76,nottheonion,'Missing' Drunk Man Spent Hours Helping a Search Party Look for Himself
77,nottheonion,Japan cybersecurity minister who doesn’t use computers now admits he doesn’t get cybersecurity either
78,nottheonion,Billy Idol - 'I'm Not 100 Percent' Over Drug Addiction
79,nottheonion,IRS tells thieves that stolen items must be reported on taxes
80,nottheonion,"Texas Gov. Asks For Federal Help With COVID Testing, Treatments As Cases Climb"
81,nottheonion,"Ontario to stop logging COVID-19 school cases, memo says; NDP calls it 'terrifying for parents'"
83,nottheonion,"Your cat could burn your house down, South Korean officials warn after 100 fires"
84,nottheonion,O.J. Simpson says his cats always ran to Betty White’s house.
85,nottheonion,"2 elderly people die, 4 taken to hospital after choking on mochi in Tokyo"
86,nottheonion,The new year once started in March—here's why | History of The New Year
87,nottheonion,Don’t Trust Gregory in FNAF Security Breach! Who is the crying child ?
88,nottheonion,Man blows up his Tesla rather than paying $22K to repair it
89,nottheonion,South Korea: Unidentified person crosses border into North Korea
90,nottheonion,Cotton Double Bedsheet
91,nottheonion,South Korean crosses DMZ in rare defection to North
92,nottheonion,South Korea Says Unknown Person Crossed Heavily Armed Border Into North
93,nottheonion,Dress Material with Dupatta Set
94,nottheonion,Police break up 50-person New Year's Eve sex orgy in Spain
95,nottheonion,"Calling breach of Sharia law, Taliban to behead 'mannequins' in Afghanistan"
96,nottheonion,/nottheonion Subdirect Statistics
97,nottheonion,Japanese Father Kills 12-Year-Old Son For Not Studying
0,nottheonion,Federal Jobs 2022 – Government Jobs 2022
2,nottheonion,"AOC claims Republicans motivated by ""sexual frustrations"" in Twitter rant amid Florida trip controversy"
3,nottheonion,French burn fewer cars on New Year’s Eve due to pandemic
4,nottheonion,"IRS reminds tax payers that income from illegal activities, including ‘dealing illegal drugs’ and stolen property, must be included on forms"
5,nottheonion,Walking your dog is no longer an exception to Quebec's curfew | Montreal Gazette
7,nottheonion,Bitcoin Private Key Finder Online
9,nottheonion,EU drafts plan to label gas and nuclear investments as green
10,nottheonion,Star Wars Battlefront 2 Mod Adds Pope John Paul II to the Game
11,nottheonion,AG: Idaho sheriff charged after pulling gun on youth group leaving thank you notes
12,nottheonion,South Korean crosses armed border in rare defection to North
14,nottheonion,Spanish town comes together in hunt for ‘Galician Rambo’
15,nottheonion,Bernie Sanders: Pay your workers better. Warren Buffett: That's not my job
17,nottheonion,Melbourne man sets himself on fire in protest of vaccine mandates
18,nottheonion,Melbourne man set himself on fire after shouting about vaccine mandates
19,nottheonion,GOP election audit demands info on Dominion voting machines in cities that don't use them
22,nottheonion,The governor of Missouri thinks looking at website source code is a crime - News Concerns
23,nottheonion,The governor of Missouri thinks looking at website source code is a crime
24,nottheonion,Prince Andrew asked to prove he can't sweat by Virginia Giuffre's lawyers
25,nottheonion,Teen’s suit says coaches made him eat pizza despite religion
26,nottheonion,People who believe COVID-19 misinformation are more likely to contract the virus.
27,nottheonion,'I make a fortune buying up abandoned shipping containers'
28,nottheonion,Abortion Leading Global Cause of Death in 2021 with 43 Million Killed
29,nottheonion,Covid? No! *Abortion* Leading Global Cause of Death in 2021 with 43 Million Killed
30,nottheonion,Florida Man calls 911 when McDonalds gets his order wrong and says he has cocaine in his butt
31,nottheonion,Founder of ‘ex-gay’ Freedom March Jeffrey McCall admits to sleeping with men
33,nottheonion,Tiger shot dead for attacking Florida man who climbed into enclosure to ‘pet him’
35,nottheonion,Eric Adams sworn in as New York City mayor after ball drop
36,nottheonion,Cops: Defendant Faked Positive COVID-19 Test
37,nottheonion,Melbourne man sets himself on fire while shouting about Dan Andrews' Covid vaccine mandate
39,nottheonion,Melbourne man sets himself on fire while screaming about Dan Andrews’ Covid vaccine mandates
40,nottheonion,Melbourne man sets himself on fire while screaming about Dan Andrews' Covid vaccine mandates
41,nottheonion,Amazon’s Alexa tells 10-year-old child to touch a live electrical plug with a penny
43,nottheonion,Cats cause 100 fires in South Korea &amp; Cat damage in the houses?
44,nottheonion,French car-burning returns for New Year's Eve
46,nottheonion,Man with an adult diaper on his head.
47,nottheonion,"Народе, радвай се! Не е за вярване колко дни ще почиваме през 2022 г."
48,nottheonion,Hillary Clinton reveals victory speech she planned to give in 2016
49,nottheonion,Twin sisters who married twin brothers and live in the same home announce they are pregnant at the same time
50,nottheonion,874 cars were torched in France on New Year's Eve -- fewer than in previous years
53,nottheonion,"RI Health Dept. opens door for COVID-infected staff to work at hospitals, nursing homes"
54,nottheonion,Anti-vax conspiracy theorists pictured doing combat training drills
55,nottheonion,Antivaxers threaten ‘radical action’ after boxing drills on beach
56,nottheonion,"In 1985, Indiana police discovered a victim with 32 separate wounds ringing the back of his skull, all from the claw end of a nailing hammer. Police ruled it a suicide."
57,nottheonion,"Woman Swaps Out Her Roommate’s Food With Vegan, Ends Up Charged With A Felony"
58,nottheonion,Vinyl sales are at a record time – has no one noticed that records are a waste of time
59,nottheonion,It rained fish over a Texas town this week in a bizarre weather event
60,nottheonion,Yankees were ‘embarrassed’ by Staten Island team’s Pizza Rat promotion
61,nottheonion,"Capitol Rioter Represents Himself, Accidentally Admits To More Crimes"
62,nottheonion,A man who was charged after stealing a Frito Lay truck asked to rap in exchange for a new car at an auto business the night before
63,nottheonion,"Man Accused of Stealing Snack Truck, Offered to Rap for New Car"
64,nottheonion,Clinton: 'It is a time for some careful thinking about what wins elections'
65,nottheonion,Texas woman’s divorce ends in explosion of wedding dress felt ‘15 miles away’
66,nottheonion,How to view any Instagram videos or Accounts without having an account?:6 tips that will tell you how to view Instagram without having an account
67,nottheonion,French burn fewer cars on New Year's Eve due to pandemic
68,nottheonion,874 cars were torched in France on New Year's Eve
69,nottheonion,"COVID-positive woman self-isolates in plane loo for five hours to protect other passengers, and posts her ordeal on TikTok"
70,nottheonion,US teacher self-isolates in plane toilet for 5 hours after testing positive for COVID-19 mid-flight
71,nottheonion,Chinese Researchers Built AI ‘Prosecutor’ That Can File Charges by Itself
73,nottheonion,French car-burning returns for New Years' Eve
74,nottheonion,"Katy Perry Brings Dancing Mushrooms, A Giant Toilet &amp; More to Wild Las Vegas Residency"
75,nottheonion,Watch Katy Perry lactate beer and sing with a dancing turd on first night of wacky Las Vegas residency
76,nottheonion,Katy Perry 'lactates' beer and drinks it as she opens Las Vegas residency
77,nottheonion,Shall I compare thee to a summer's day? Simple English |
79,nottheonion,"Hy-Vee creates retail security team, a video shows them with guns, tasers and body cameras"
80,nottheonion,Hy-Vee unveils armed ‘retail security team’ amid theft surge
82,nottheonion,"North Korea's Kim talks food, not nukes for 2022"
83,nottheonion,React to a Message with an Animated Emoji. What is Telegram Message Reactions?
85,nottheonion,Taliban order beheading of shop mannequins
87,nottheonion,Alexandria Ocasio-Cortez says GOP is 'projecting their sexual frustrations' after former Trump adviser comments on her vacation photo
89,nottheonion,Pakistani man threatens Pepsi to remove QR code on 7UP bottles alleging desecration of Prophet Muhammad
90,nottheonion,IRS wants drug dealers and thieves to report their illegal gains for taxation.
92,nottheonion,Who is the Cutest and Most Attractive in Blackpink? Who is the Queen of the K-pop?
93,nottheonion,An H&amp;M Store in NYC Closes After Employee Shares Photo Showing Bugs on Clothing
94,nottheonion,Kim Jong-un’s New Year Resolution: More Food for North Korea
95,nottheonion,"NHL: Ice will need to be heated, because outside temp will be too cold during Winter Classic."
96,nottheonion,China develops AI 'prosecutor' that can charge citizens with crimes with '97% accuracy'
97,nottheonion,Men try to rob bank in Minneapolis suburb with ‘a vial of HIV’
98,nottheonion,Katy Perry lactates beer onstage during Las Vegas residency
99,nottheonion,"SYMPTOM CHECKER How to tell if your symptoms are Omicron, Delta, a cold or flu"
0,nottheonion,Virginia Giuffre: Prince Andrew accuser seeks evidence he could not sweat
1,nottheonion,The governor of Missouri still doesn’t know how websites work
2,nottheonion,North Korea's Kim talks food not nukes for 2022
3,nottheonion,"Evolution Keeps Making And Unmaking Crabs, And Nobody Knows Why"
4,nottheonion,What disease does Pete Davidson have? What is BPD syndrome?
5,nottheonion,Piece of wood coming out of a Coca Cola bottle
6,nottheonion,Watch Miley’s New Year’s Eve Party Hosted by Miley Cyrus and Pete Davidson + Brandi Carlile
7,nottheonion,Fish fell from the sky in East Texas
8,nottheonion,Happy New Year and Welcome to 2022. Watch Times Square Ball Drop in New Year’s Eve
9,nottheonion,Parents sue officials over ruling that their daughter's death by more than 20 stab wounds was a suicide
10,nottheonion,"A woman with 20 stab wounds died of suicide, an autopsy found. Her parents are unconvinced: ‘It makes no sense’"
11,nottheonion,Oregon man who uttered ‘Let’s go Brandon’ during Biden call-in event mulls running for office
12,nottheonion,MSNBC interrupts Congresswoman for report on Justin Bieber
13,nottheonion,Bengaluru girl plotted mother’s murder with help from stepfather-lover | Bengaluru News - Times of India
14,nottheonion,"Man who said 'Let's go, Brandon' to Biden on Christmas Eve says he was only joking"
15,nottheonion,nude animation in animiz
16,nottheonion,Indian state education department shuts down school for serving meat on Christmas.
17,nottheonion,Trending
18,nottheonion,So my father a coke head cop I thought it would be smart to move in with him for a year a quite a big Narcissist to let me explain……..
20,nottheonion,Great Polar Bear Challenge (Idaho) Canceled due to too Much Snow and Ice
21,nottheonion,"Accused of Refusing Aid to Disabled Kids, a State Agency Responded — by Hiring a PR Firm"
22,nottheonion,Chicago woman quarantines for 3 hours inside airplane bathroom
24,nottheonion,Unusual phenomenon causes fish to rain from sky in Texas town
25,nottheonion,Destitute Mughal empire ‘heir’ demands India ‘return’ Red Fort
26,nottheonion,"Fish fall from the sky during rain in east Texas, city reacts"
28,nottheonion,BlackBerry will die on January 4th — for real this time
29,nottheonion,"Utah driver 9 times over legal limit claimed passenger had too much to drink, police say"
30,nottheonion,Rand Paul Accused Dems Of 'Stealing' Elections By Convincing Voters to Vote for Them
31,nottheonion,Man's 'Deathbed Confession' Reveals 50-Year Secret He Was A Fugitive. Lived for decades on the run in suburban Boston.
32,nottheonion,"Morgan Wallen, Currently No. 1 on Hip-Hop Chart, Says He’d Like to Work With Kendrick Lamar"
33,nottheonion,"HOW TO USE WINDOWS 10 VIDEO EDITOR: FREE VIDEO EDITING SOFTWARE Do you know that Windows 10 has a complete set of video creation and editing tools that you can easily use to tell your story? It has text, music, motion, and 3D effects."
34,nottheonion,TIL about a company called Washboard that launched in 2014 that mailed you $10 in quarters each month for your laundry machine at a cost of $14.99. They signed up less than 10 customers
35,nottheonion,McDonald’s blocked from building drive-through at Rome’s ancient Baths of Caracalla
36,nottheonion,What happend to the GTA V loading screen
39,nottheonion,"As prosecutors mull charges in Naples tiger attack, zoo chief says he forgives victim's 'bad mistake'"
41,nottheonion,"Space Colonists Will Likely Resort to Cannibalism, Scientist Says"
43,nottheonion,Man who stole Frito Lay truck offered to 'rap' in return for a new vehicle at neighboring business
45,nottheonion,"McDonald’s loses Big Mac trademark. Burger King adds ‘Like a Big Mac, but actually big.'"
46,nottheonion,"Man attempts to pay for car with rap, steals potato chip truck"
47,nottheonion,Former UFC fighter reveals past as sex worker to fund mma career
50,nottheonion,Legendary actress Betty White dies at 99 on New Year's Eve. Screw you 2021!
51,nottheonion,"Toyota Corolla Hits 50 Million Sold, Gets Its Own Manga"
52,nottheonion,Illinois Holocaust Museum Begins Requiring Visitors to Show Approved Travel and Vaccination Papers
54,nottheonion,"Woman Tests Positive For COVID, Quarantines In Airplane Bathroom For 5 Hours"
60,nottheonion,California school boards to ban 'D' and 'F' grades
61,nottheonion,France offers intensive care nurses €100 monthly bonus amid Covid-19 exhaustion
62,nottheonion,Parson says he believes prosecutor will bring charges in Post-Dispatch case
64,nottheonion,Growing a beard is not mandatory: Taliban
66,nottheonion,"Betty White's secret to a long, happy, healthy life (Hint: it came from her mom)"
67,nottheonion,"Betty White, The Golden Girls and Hot in Cleveland Star, Dead at 99"
68,nottheonion,"Call me a thespian not an actor, says Nicolas Cage"
69,nottheonion,Giuffre lawyers seek details on Prince Andrew’s claimed inability to sweat
70,nottheonion,Betty White Dead at 99
71,nottheonion,Central Texas Red Cross sending at least one volunteer to Colorado after devastating fires
