index,subreddit,title
12,nottheonion,Dr. Oz Gave Dr. Oz Show Staff 15 Minutes’ Notice That He’s Quitting to Run for Senate in State Where He May Not Live
13,nottheonion,Missing Ohio Guard Soldier SPC Michaela Nelson Found Alive. Apparently Her Phone had Died.
15,nottheonion,Marketwatch article posts u/wetdirtkurt 's twitter who changes profile pic to butthole and f marketwatch. Bonus griffin stache pic
16,nottheonion,New aerial video shows catastrophic damage at B.C.’s Jackass Mountain on Highway 1
17,nottheonion,Tesla and Elon Musk mock 'silly Apple Cloth' with new $50 Cyberwhistle
18,nottheonion,"Double play! Fayetteville man accidentally enters same lottery numbers twice, wins two lifetime $25K jackpots"
19,nottheonion,Robot company offers $200K for your face
20,nottheonion,Israel Postal Company Blames Losses on Need to Deliver Mail
21,nottheonion,Texas televangelist who was anti-vaccine dies after 'spiritual attack' from COVID-19
23,nottheonion,LA County Disputes Sheriff Villanueva's Claim That China ‘Likely’ To Get DNA Data From COVID-19 Tests
24,nottheonion,Florida state senator files bill to allow employers to offer sub-minimum ‘training wage’
25,nottheonion,"Qatar 2022 : Amid ongoing human rights concerns, World Cup chief promises Qatar is 'tolerant' and 'welcoming'"
26,nottheonion,"Britney Spears Stops at Gas Station, Uses Restroom — TMZ"
27,nottheonion,Deputies: Man in car stopped for speeding calls 911 to falsely report robbery
28,nottheonion,Satanic Ritual becomes one of the only ways to get an abortion in Texas
29,nottheonion,"More Than 2,000 Flight Records Associated With Jeffrey Epstein's Private Jets Accidentally Disclosed By The FAA"
30,nottheonion,Brock Turner Wants His Sexual Assault Convictions Overturned
31,nottheonion,"The FAA accidentally disclosed more than 2,000 flight records associated with Jeffrey Epstein's private jets"
32,nottheonion,Pregnant woman drives to burning home to save man who had fallen asleep
33,nottheonion,"Parents name their new-born child ""Dovahkiin"" (the protagonist's name in Skyrim) on 11/11/11 to get Bethesda games for life"
34,nottheonion,"Britney Spears Stops at Gas Station, Uses Restroom"
38,nottheonion,"Parents name their new-born child ""Dovahkiin"" (the protagonist's name in Skyrim) to get Bethesda games for life"
39,nottheonion,Why There's a Huge Santa Shortage This Year
40,nottheonion,An assistant principal in D.C. also worked as a principal in Rhode Island — at the same time
42,nottheonion,Indiana Woman Must Shut Down Business After County Officials Determine Her Farm Isn't Zoned for Commercial Goat Yoga or Goat Snuggling
44,nottheonion,Satanic Ritual Sacrifice becomes one of few options for abortion in Texas.
47,nottheonion,"Bisexual Michigan Teacher resigns after being told to remove Pride Flag. What is LGBTQ ? Stands for Lesbian, Gay, Bisexual, and Transgender"
48,nottheonion,Car driven with wooden plank nailed to sunroof
49,nottheonion,Police: Suspect was stealing Pokemon cards before shootout with officer
50,nottheonion,Video shows sex-crazed bull elephant charging trainee safari guides in South Africa
51,nottheonion,"Oxford High School Shooting Michigan : 3 killed, 6 injured"
52,nottheonion,German euthanasia group says it will only carry out assisted suicides on people vaccinated against Covid-19
53,nottheonion,Armed Taliban fighters seen riding pedal boats on lake in Afghanistan
54,nottheonion,"Georgia cam girl, 27 accidentally shot herself in vagina live on stream"
55,nottheonion,Woman fires gun at her vagina in cam show crotch shot gone horribly wrong
56,nottheonion,[Martyn Ziegler] Premier League commits to investigate growing links between clubs and cryptocurrency firms - but is also considering an NFT partnership itself.
57,nottheonion,Walmart said she shoplifted; jury awards her $2.1 million
58,nottheonion,Salvation Army defends guide telling white people to apologize for racism
60,nottheonion,Oakland Mayor Seeks to Reverse Police Cuts Amid Crime Spike
62,nottheonion,Oakland mayor seeks to reverse police cuts amid crime spike
63,nottheonion,Experimental Chewing Gum Could Reduce Coronavirus Spread
64,nottheonion,Omicron Variant Delays Global Vaccine Patent Fight
65,nottheonion,"She was beaten by Philadelphia police in front of her toddler. Now, the city is paying her $2M."
67,nottheonion,"Black mother wins $2m payout from police who pulled her from car, beat her and seized her child for no reason."
68,nottheonion,Woman Sues Police Union for Using Her Son for Photo-Op—After Beating Her Up
69,nottheonion,Dr. Oz To Run For U.S. Senate in Pennsylvania
70,nottheonion,Sperm is being used to create an eco-friendly alternative to plastic
72,nottheonion,Hand sanitizer recalled because packaging looks like water bottles
73,nottheonion,"Twitter hashtag calls white people 'mayo monkeys,' group chat talks of 'white genocide'"
74,nottheonion,Buy Verified Paypal Account . 100% best verified paypal account .
75,nottheonion,Harrow Man Rishiel Gudka with testicular cancer says Deadpool ‘saved my life'
76,nottheonion,"""Intervention"". Hole in the wall. Neighbors argue about the size of the apartment (Google Translate)."
77,nottheonion,Huge cannabis farm found in former magistrates' court next door to police station
78,nottheonion,The Dollar Tree will henceforth price all of their goods at $1.25
79,nottheonion,North Korean teen sentenced to 14 years in prison for watching five minutes of film
80,nottheonion,Ordering the future: The University of Arizona deploys food delivering rovers
81,nottheonion,Scalpers Are Selling ‘Spider-Man: No Way Home’ Tickets for Absurd Prices
82,nottheonion,"Woman runs onto LAX tarmac, tells officers 'she was trying to flag down the aircraft,' police say"
83,nottheonion,Psychics and astrologers are huge on Instagram. Now scammers are impersonating them
84,nottheonion,"Doctor gets anti-vax abuse, community now needs a doctor"
85,nottheonion,PETA Launches Human Leather 'Shop'
87,nottheonion,Florida man playing Judas in ‘Jesus Christ Superstar’ accused in Jan. 6 Capitol riot
88,nottheonion,16-Point deer harvested in Missouri turns out to be doe
89,nottheonion,Cardi B moves into lavish home in N.J. — even though she says it’s in New York
90,nottheonion,Barbados Ditched The Queen And Immediately Declared Rihanna A National Hero
91,nottheonion,We thought this bear was out cold. We were mistaken.
92,nottheonion,A QAnon follower wrote an open letter to Trump complaining that the movement’s predictions kept turning out to be false
93,nottheonion,New republic Barbados names Rihanna national hero after removing Queen Elizabeth
94,nottheonion,Golf Digest Tiger Woods Interview : Tiger Woods Speak About Car Crash and He says his days of being a full-time golfer are over
95,nottheonion,Man Shot While Trying To Sell His PlayStation 5
96,nottheonion,Air New Zealand flight attendant named CEO after one year on the job.
97,nottheonion,“Invasive species” has a harmful nativist bias
98,nottheonion,"QAnon Follower Writes Open Letter to Trump, Says Predictions tun out False"
99,nottheonion,A QAnon follower wrote an open letter to Trump complaining that the movement's predictions kept turning out to be false
0,nottheonion,Horrific 'Human’ Leather Goods Advertised On PETA's Chilling Guerilla Store
2,nottheonion,Spider-Man: No Way Home (2021)Full Movies Download (English-Hindi) Free Download HD mkv
3,nottheonion,Marines examine plans to eliminate ravens
4,nottheonion,Enes Kanter Freedom Tells Tucker Carlson That People Shouldn’t Criticize the United States
6,nottheonion,"Canadians all crash their cars on the first snow day, it's because we're idiots"
7,nottheonion,"Canadians all crash their cars on the first snow day, it's because we're idiots — National Post"
8,nottheonion,This calendar of Jack Grealish's calves could be perfect Christmas gift
9,nottheonion,33-Year-Old Man Boycotts Tinder After First Four Matches Didn’t Care That He’s Met Nate Sexton
10,nottheonion,Judge Rejects “Divine” Authority Claim Of Ex-‘Jesus Christ Superstar’ Actor &amp; Accused Rioter As “Gobbledygook”
12,nottheonion,What are Covid 19 Omicron Variant Symptoms?
13,nottheonion,Barbados declares Rihanna a national hero after ditching Queen Elizabeth II as head of state
14,nottheonion,Missing the point: Man in Germany drives himself to driving test
15,nottheonion,Practical GDPR Compliance Guide for Startup Founders
16,nottheonion,Mind Debris Magazine - Goal Setting
17,nottheonion,Connecticut: Star-nosed mole
19,nottheonion,"Santa Claus Attacked In Hawk Auto, Joliet Police Make Arrest of former Plainfield Park District commissioner."
20,nottheonion,"Government to push for international ban of autonomous weapons, or killer robots"
21,nottheonion,Canadian school cancels event with ISIS survivor out of fear of offending Muslim students
22,nottheonion,Burglars knock hole in wall to steal Lego bricks
23,nottheonion,Let’s brush up on our market mechanics.
24,nottheonion,"‘Wonderwall’ of snow traps drinkers, and Oasis tribute band, in remote U.K. pub"
25,nottheonion,Miss USA Pageant Winner 2021 and Miss Kentucky : Elle Smith. Represent the USA in the Miss Universe pageant in Israel
26,nottheonion,"A Photo of Poop Snapped in 2004 Being Auctioned on OpenSea, Protest Against Creativity-Draining Pixelated and Auto-Generated NFT Avatars"
27,nottheonion,Toronto organizes mass COVID-19 vaccination clinic for children at Scotiabank Arena
28,nottheonion,"New Mexico police chief faces charges for impersonating a peace officer, battery"
29,nottheonion,"Shiba inu (SHIB) Soars more than 20% after Crypto Exchange Kraken’s listing, and Trading Volume Spikes to $3.6 Billion. the Most Dangerous Cryptocurrency?"
32,nottheonion,"Environment minister's bicycle a political prop that breaks House rule, Conservative MP says"
33,nottheonion,"Celtics player becomes US citizen, legally changes last name to 'Freedom'"
35,nottheonion,MPs back setting new-build house ground rent at one peppercorn a year
36,nottheonion,Guerilla Market Sells ‘Human-Skin’ Jackets and Bags in Jab at Urban Outfitters
38,nottheonion,‘HUMAN LEATHER’ ON PETA’S URBAN OUTRAGED STORE BAFFLES TWITTER
40,nottheonion,"11-year-old boy arrested, considered a 'prolific carjacker'"
41,nottheonion,Queen replaced by Rihanna as national hero as Prince Charles witnesses Barbados becoming a republic
42,nottheonion,Transgender Miss USA contestant eliminated early
43,nottheonion,In Australia our birds like browsing hardware and beers after work
44,nottheonion,Episode of The Simpsons mocking Chinese censorship missing from Disney+ in Hong Kong
45,nottheonion,Hastings RNLI lifeboat crew ‘blocked from going out to sea’ by people angry at them rescuing refugees
46,nottheonion,"QAnon follower writes open letter to Donald Trump over failed predictions—""Tired of it"""
47,nottheonion,Fans Were Snowed in for Three Days in a Remote Pub After They Went to See an Oasis Cover Band
48,nottheonion,Is 'Restless Anal Syndrome' a Real COVID Side Effect?
49,nottheonion,11-year-old arrested for carjacking of police sergeant's wife
50,nottheonion,"Tiger Woods says his days of being a full-time golfer are over: 'Never full time, ever again'"
51,nottheonion,One in three Australian parliament staff sexually harassed
52,nottheonion,The Civilian – Air New Zealand flight attendant named CEO after one year on job
54,nottheonion,"World's first living robots can now reproduce, scientists say"
55,nottheonion,"Morrisville man who went missing after crash returns home weeks later, says he was in the woods"
56,nottheonion,North Carolina Man Who Went Missing 2 Weeks Ago Walks Home
57,nottheonion,"Everyday, here on Earth, it's something more and more bizarre. 😬"
58,nottheonion,"In novel protest, group urinates in Gadag municipal office demanding repairs of public toilets"
60,nottheonion,"All but one episode of the Simpsons to debut in Hong Kong: namely, the one with Tinamen Square being erased from public memory."
61,nottheonion,Oasis Cover Band Finally Escapes From Yorkshire Pub After Being Snowed in for Three Days
62,nottheonion,New Mexico State to drop parking citations for peanut butter
63,nottheonion,Oasis tribute band stranded with revellers in Yorkshire pub have finally escaped
65,nottheonion,"Lucian Freud painting denied as his is genuine, BBC finds"
66,nottheonion,"Lucian Freud naked portrait thought to be artist himself, experts say"
67,nottheonion,"Boston man arrested after telling T rider his mask made him ‘look like a duck,’ threatening to kill him."
68,nottheonion,Bengaluru: Bodies of two COVID-19 patients rotting in mortuary since 2020
69,nottheonion,Bodies Rotting Since 2020: Horror For 2 Families Struck by Covid
70,nottheonion,"Ex-Google workers sue company, saying it betrayed 'Don't Be Evil' motto"
71,nottheonion,Amazon Creates Online Looting App To Allow The Timid To Loot From Home
73,nottheonion,"""Australia doesn’t need to legalise cannabis, but we should at least give it a shot"" 😄🌬️"
74,nottheonion,Royal Ballet dancer to auction world’s first ballet NFTs | Ballet | The Guardian
75,nottheonion,Google workers say they were fired for following ‘Don’t Be Evil’ slogan
77,nottheonion,Actor who played Judas in court over Capitol riot
78,nottheonion,He ordered a letterman jacket in high school but couldn't afford to pick it up. His brother just found it at a thrift shop 28 years later
79,nottheonion,Would-be Florida burglar dies after window slams down on him
80,nottheonion,"Window falls during attempted burglary, fatally strangling Lehigh Acres man"
82,nottheonion,Fired Employees Sue Google for Breaching 'Don't Be Evil' Part of Contract
83,nottheonion,Santa shortage looms as holidays draw near
84,nottheonion,"Struggling poo-testing startup uBiome files for bankruptcy, months after FBI kicks off investigation"
85,nottheonion,PETA launches gruesome online shop with goods made of ‘human’ leathers
86,nottheonion,Divorce Rates in Albatrosses May Be Rising Due to Climate Change: Study
87,nottheonion,Marx and Lenin watch Engels wed in southern India’s Kerala
89,nottheonion,Right-wing Tennessee group says learning about civil rights movement gives kids 'emotional trauma'
90,nottheonion,German euthanasia clinic refusing unvaccinated customers
91,nottheonion,The first complaint filed under Tennessee's anti-critical race theory law was over a book teaching about Martin Luther King Jr.
92,nottheonion,Death row inmate who survived a botched execution attempt dies of cancer
93,nottheonion,University of Toronto student union bans ‘pro-Israel’ kosher caterers
94,nottheonion,Man applying for Washington State Patrol job gets arrested during interview;
95,nottheonion,Arizona students seek Kyle Rittenhouse removal from online nursing classes.
96,nottheonion,Suspected 15-person knife fight in NE Portland ends in hit-and-run death
97,nottheonion,"Hot Anime Guy Apple Posters Had ""Too Much Impact"" For Some Stores"
98,nottheonion,Enes Kanter says he will change his name to Enes Kanter Freedom and become US citizen
99,nottheonion,NHS England to test Netflix-style subscriptions for antibiotics
0,nottheonion,California town declares itself 'constitutional republic' to evade COVID rules
1,nottheonion,Pantos can go ahead this Christmas but don't bring the children – Health Minister | JOE.ie
2,nottheonion,Government says that children’s pantomimes can go ahead but children shouldn’t go.
3,nottheonion,Kayleigh McEnany rips Biden on COVID: 'No one has politicized this virus more'
4,nottheonion,A man who was on the run since 2012 turned himself in after a true-crime episode featuring his case aired on TV: report
5,nottheonion,The BBC changed the name of a documentary from 'Megxit' to 'Sussexit' after Prince Harry said it was sexist
6,nottheonion,Global maple syrup shortage forces Quebec to release half its strategic reserve | Globalnews.ca
8,nottheonion,Fox News suggests Democrats invented Omicron variant
9,nottheonion,Alabama inmate who survived execution attempt dies of cancer
10,nottheonion,Canada opens emergency maple syrup supplies
11,nottheonion,Bobby Shmurda Says He Should Get Sex Therapy: ‘I Need to Be Stopped’
12,nottheonion,Hong Kongers are paying to go on 'bus rides to nowhere' to have a quiet spot to doze off for 5 hours
13,nottheonion,Health confused Africa with Asia and a cruise ship coming from Cape Verde entered Argentina
14,nottheonion,California town declares itself ‘constitutional republic’ to protest COVID mandates
15,nottheonion,"To protest COVID mandates, this California town declared itself a 'constitutional republic'"
16,nottheonion,Sweden's parliament just elected first female prime minister – for the second time in a week
18,nottheonion,"""Invasive Species"" has a Harmful Nativist Bias"
19,nottheonion,Matthew McConaughey Decides to Not Run for Texas Governor
20,nottheonion,Words and phrases you may want to think twice about using
21,nottheonion,Broadway actor playing Judas in 'Jesus Christ Superstar' arrested in Milwaukee for Capitol Riot
22,nottheonion,Woman and granddaughter kicked out of U.S. hotel at 8:40 p.m. for three-star review
23,nottheonion,"Due to the Omicron Variant, Israel bans all foreigners except beautiful women."
27,nottheonion,Canada tapping reserve maple syrup supply.
28,nottheonion,Canada taps into strategic maple syrup reserves.
29,nottheonion,Kidnapping Expert Kidnapped In Mexico
30,nottheonion,"‘Just because Cam Newton is on your roster it doesn’t mean you’re just going to win,’ says Cam Newton"
31,nottheonion,Armed Forces helicopter crew met with grilled cheese and kindness after being grounded along Fraser River
32,nottheonion,"Now that Florida has tackled vaccines, it's time to address hand-washing mandates | Frank Cerabino"
34,nottheonion,Southlake school leader tells teachers to balance Holocaust books with 'opposing' views
35,nottheonion,"In Germany, You Must Be Fully Vaxxed before Your Death by Assisted Suicide"
36,nottheonion,German Suicide Factory Says It Will Only Help You Kill Yourself If You’re Vaxxed
37,nottheonion,"BMW drivers are more likely to be psychopaths, study shows"
39,nottheonion,Swedish Prime Minister Magdalena Andersson who quit on first day is reappointed
40,nottheonion,20-year-old woman suing her mother's general practitioner for allowing her to be born
41,nottheonion,Turkish NBA player adds Freedom to his name to toast US citizenship
42,nottheonion,The British Fashion Council launches new award category for Roblox designs
43,nottheonion,"BMW drivers are most likely to be psychopaths, survey says"
45,nottheonion,Jack Dorsey Expected to Step Down as Twitter CEO. Twitter CTO Parag Agrawal will replace Jack Dorsey as CEO
46,nottheonion,Discover The Highest Paying Jobs For The Next Coming 10 years - kiwiwell
47,nottheonion,Don’t Eat Cow Dung To Protect Against Covid-19 Coronavirus Despite These Claims
48,nottheonion,Westlife to invite Coleen Rooney and Rebekah Vardy to gig in hopes of peace deal
49,nottheonion,Jussie Smollett Trial : Allegedly Staging crime. Brothers say Smollett Paid them to pose as his Attackers !
50,nottheonion,Staatssecretaris voor Gendergelijkheid Sarah Schlitz onder vuur omdat ze naar event gaat waarop mannen niet welkom zijn
51,nottheonion,Minibus volunteer 'driven to drink after Northern Ireland accents revived bad memories'
53,nottheonion,California town declares itself a ‘constitutional republic’ to buck Covid rules
54,nottheonion,California town declares itself a ‘constitutional republic’ to buck Covid rules | California
55,nottheonion,Serbian president says person with excavator who tried running over protestors didn't do anything wrong.
56,nottheonion,Vučić o muškarcu koji je bagerom krenuo na ljude: Ništa loše nije uradio
57,nottheonion,Disney+ appears to censor episode of The Simpsons in Hong Kong referencing Tiananmen Massacre
58,nottheonion,Police: Bullets in toaster oven start fire in assisted living facility room
59,nottheonion,Dozens stuck in British pub with Oasis cover band for three days after storm
62,nottheonion,"Hong Kong election pledge of 'no change' among candidate introductions, only 4 of 153 mention democracy"
64,nottheonion,Israel bans all foreigners except beautiful women due to Omicron variant
66,nottheonion,"Errant turtle closes runway, delays turtle-themed plane"
67,nottheonion,Israel Bans All Foreigners Except Beautiful Women Due to Omicron Variant
68,nottheonion,"World’s First Vaccine Murder case against Bill Gates, Adar Poonawalla filed in India’s High Court"
69,nottheonion,"Snowstorm strands 61 in pub for third night, ‘plenty of beer available’"
70,nottheonion,Employees of concentration camp memorial are getting called nazis and fascists by anti-vaxxers
71,nottheonion,Tory MP Sir Geoffrey Cox defends ‘honourable’ second job as lawyer for tax haven
72,nottheonion,Shopify Tools For New Entrepreneurs 2021 | Free WordPress themes
73,nottheonion,Preacher says reptile masked as her husband tried to have sex with her
74,nottheonion,Watch: Preacher claims reptile masked as her husband tried to have sex with her
75,nottheonion,Hamas to take legal action against UK for declaring it terror group
76,nottheonion,Walmart Pulls Children's Toy That Swears and Sings in Polish About Doing Cocaine
77,nottheonion,Tory MP who linked male crime to female Doctor Who faces sleaze probe | Daily Mail Online
78,nottheonion,new designing dresses video.
79,nottheonion,Germany: Illegal private test run of unapproved Covid-vaccine stopped after dozens were vaccinated
80,nottheonion,A Satirical Tribute to Our New Idols: The Influencers
81,nottheonion,Walmart pulled this cute kid’s toy because it swears and sings about cocaine in Polish
82,nottheonion,"Stray Dog Visits Hyundai Dealership Every Day, Gets “Hired” as Mascot"
83,nottheonion,It’s time to stop demonizing “invasive” species
84,nottheonion,Previous govt responsible for Afghan food crisis: Taliban
86,nottheonion,Most expensive subway extension in world history called a ‘bargain’
87,nottheonion,This Is Probably the World’s First Ever Suit Made of Men’s Mustache Hair
88,nottheonion,"Haryana doctor eats cow dung to purify mind, body and soul"
89,nottheonion,Teenager stole car and then pretended to be asleep when found by police
90,nottheonion,Apparent Jilted Ex Spray Paints “Mike Is A Cheater” On Wrong Car
91,nottheonion,"Apparent Zilted ex-spray paint ""Mike is a scammer"" in the wrong car"
92,nottheonion,"Apparent Jilted Ex Spray Paints ""Mike Is A Cheater"" On Wrong Car"
94,nottheonion,Tesco boycott threat after Santa seen with vaccine passport
96,nottheonion,"Boss asks employees to stop charging mobile phones at office, calls it electricity theft - Technology News"
97,nottheonion,Covid-struck Czech President appoints new Prime Minister from inside a glass box
98,nottheonion,Wisconsin GOP Wants to Eliminate Bipartisan Election Commission They Created and Jail Members
0,nottheonion,Apetor Died Tragically 5 Days After Posting Video Telling His Fans He Wasn't Dead
1,nottheonion,The OPEC of Maple Syrup Taps Its Stockpile to Make Sure Your Pancakes Are Covered
2,nottheonion,Kazakhstan plays Iran anthem for Syria at FIBA WC qualifiers
3,nottheonion,Kazakhstan plays Iran anthem for Syria at basketball World Cup qualifiers
4,nottheonion,Webcam model accidentally shoots herself in vagina while filming X-rated clip
5,nottheonion,"Plumbers prepare for ""Brown Friday"""
6,nottheonion,"Jared Leto Said He Was ""Snorting Lines Of Arrabbiata Sauce"" For His ""House Of Gucci"" Role"
7,nottheonion,'Could offend students': Canada school board cancels book club event with Yazidi Nobel laureate
9,nottheonion,What Red Flags? Elizabeth Holmes Trial Exposes Investors’ Carelessness
10,nottheonion,"Next Windows 11 update brings back Clippy, along with other redesigned emoji"
12,nottheonion,"Facing shortages, Canada taps its strategic reserves of maple syrup"
14,nottheonion,Warming centre catches fire twice in Inuvik
15,nottheonion,Canada taps strategic supply of maple syrup to counteract severe global shortage
16,nottheonion,Hampshire Air Ambulance branded 'inconsiderate' for 4am flight
17,nottheonion,Sociology prof steps down after calling pedophiles ‘minor attracted persons’
18,nottheonion,Biden clams up when Nantucket business owner challenges him to name his favorite chowder
19,nottheonion,"Lebanese central bank blames Google, Facebook as currency hits all-time low"
20,nottheonion,Painting That Depicted George Floyd as Jesus Stolen From Catholic University
21,nottheonion,Filipino Faith leader says the corona virus will get worse because people are charging him with sex trafficking.
22,nottheonion,North Korea is banning leather coats to prevent its people from imitating Kim Jong Un's fashion style
24,nottheonion,North Korea is banning leather coats to prevent its people from imitating Kim Jong Un's fashion style.
25,nottheonion,Kim Jong Un bans leather jackets so citizens won't copy his look.
26,nottheonion,North Korea fashion police? Kim Jong-un imposes crackdown on people imitating his style.
27,nottheonion,Pharmacist arrested for selling whale vomit worth over $2M
29,nottheonion,"The W.H.O. skips forward two Greek letters, avoiding a Xi variant."
30,nottheonion,This Year's Hottest Toy Is a Cocaine-Using Polish Cactus
32,nottheonion,"15-year-old boy was convicted of inciting his own murder, by using multiple identities on internet chatrooms"
34,nottheonion,Nearly 400 FedEx packages dumped and found in Alabama woods
35,nottheonion,"A stowaway was found in the landing gear of a plane at the Miami airport, authorities say"
36,nottheonion,Man who ran over and stabbed partner after eating 'space cake' cleared of murder
